"[""OK so the robots *are* killing people now, but at least they're just going after the tax cheats.  Why is everyone so upset?"", ""Robots don't need sleep or time off. They will do things predictably around the clock and won't mind being made fun of, insulted, treated like objects. Also they won't tell anyone about your house or family (unless they are spying robots, of course). You can also just turn them off and on at will. Many advantages over breathing sensitive unreliable meat bags who may or may not be talking about you behind your back.""]"
"['Screenwriter are coming from the position that they are entitled to write for Hollywood movies and shows.\n\nI feel for the writers - when discussing robots and AI it was the arts that were always presumed to be safe... yet here we are where authors and illustrators are the first/heaviest to be impacted.\n\n&#x200B;\n\nHaving said that I don\'t know that screen writers \\*are\\* entitled to write for Hollywood.  Hollywood has largely become repetitive formats.  The creativity is relatively low, there aren\'t many shows that stand on dialog and it\'s mostly special effects and copy/paste/recycle - because it works (where ""works"" = generated the most money).\n\n&#x200B;\n\nAnything that follows a pattern is going to be ripe for AI takeover.', 'Yeah, and ai came for it first. Replacing artists, writers, and even threatening music. It’s just an extension of capitalist corporations who see a utopia where they no longer need talented(Skilled) individuals to help them build profit.\n\nThey used systems which scrapped everyone’s private/copyrighted work by the billions to train machines that can compete with and replace them in their own fields. It’s crazy, humans love to create. Artistry is a passion endeavor, and regular people are more than happy to fund or support robots taking that, cuz consumerism. \n\nI hope regulations are made, and precedence is set within the courts.', ""No it doesn't, really.\n\nFor example, in programming. ChatGPT can write code. But writing code is only part of what a programmer does. Part of the job of a programmer, is figuring out what the customer really needs, not what they think they need. Then there's coming up with an overall design. Figuring out what the customer might already have that can be leveraged. Figuring out how to integrate with other systems they may already have.\n\nChatGPT can't do all of that. Maybe some day, but we're a long way away from that.\n\nFrom a writing perspective, you can't just tell it to write a movie script for an entire movie. That won't work. You have to break it down into pieces. And so part of that is coming up with an outline for your overall story. And then putting those pieces together. And part of it is having a human being that can recognized a shitty story or scene and know what to throw away.\n\nAI isn't replacing humans yet. It's a tool that helps you do your job. Just like a sewing machine helps a seamstress do their job, or a robot helps auto workers put a car together."", '>It\'s not just writers. It\'s finance people, it\'s teachers, it\'s most office job people. \n\n>Only thing untouched is blue collar jobs until humaniod AI takes over those jobs in a decade or so. \n\n>You having a hard time doesn\'t make the world injust. It\'s just you having a skill issue. \n\n>You can always work minimum wage labor jobs. \n\nThe level of stupidity in this comment is astounding.\nYou go from talking about how AI will take higher skilled jobs and then blue-collar jobs. Then you end up with ""you can always work minimum wage labour jobs"". \n\n1. Those minimum wage labour jobs are gone to the robots and AI. YOU established that.\n2. Minimum wage jobs don\'t leave you any money to ""save for shares"" as per your other brain-dead ideas.\n\nI could go on, but I\'m not wasting any more energy on someone who will be one of the first to be replaced.']"
"[""Short term I see this being horrible. Long term I see this as an absolute win. The only way I can imagine surviving with all these jobs taken away is with a universal basic income. If a company adopts robots/AI they should pay a much higher tax and this should help pay for a UBI. Get the cost of production and operating basic needs like farming so low that food is basically free. Will this happen in my lifetime? Probably not. Do I think it will happen eventually, yea it's the only way I see this playing out after years of battling for our rights""]"
"['I believe in evidence based medicine, which homeopathy is not.\n\nEvidence shows healthcare severely lets people down when it comes to a lot of social and spiritual needs. Even things as basic as empathy. All I said is approaching things philosophically can give you an edge over the more robot-like healthcare employees who think of their job as more of an equation to solve than a living human being and all the multitudes that that entails.\n\nDo you thing our profit driven model of healthcare is objectively the best way to treat people? Or do you think that in the process of minimizing costs and maximizing the amount of people seen maybe probably has resulted in unforeseen shortcomings that relate to a patients ~humanity~?\n\nIf you think I’m on to something, how can one even approach it without pondering the nature of the human condition? Im not telling people to join my cult or anything, I’m just suggesting that there’s a certain level of comfort and understanding people can provide if they think beyond just acting simply kind.', 'I just don’t get what your point even is. I pointed out the irrationality in accepting a weird belief and you brought up your medical background, as if that’s relevant to whether or not that guys logic was sound. It wasn’t, but we started talking about medical sciences in that context and I strongly disagree that doctors should be approaching ideas in that way. You literally said “I’m with that guy” so I don’t really get why you back peddled and went to “well, I’m just being open minded because in my field, it’s better to be empathetic and understanding”. \n\nI don’t see how those two are exclusive. You don’t have to sound like a robot to not accept wacky ideas about an afterlife from one comment lol. It doesn’t have anything to do with your job so I didn’t really feel like focusing too much time on replying to your thoughts on the industry, except where irrational medical experts are failing our society. You seemed to just use your medical background as a means to garner credibility for why you are rational in accepting it. It really just doesn’t make sense and I simply feel like it’s important to tell people “that doesn’t make sense”. Too many people are so concerned with “being open minded” that they suffer irrationality until it’s just normal to them. If you’re claiming to be in the medical field, then I have a big problem with it. Homeopathy, medical insurance, and the failure to properly educate the public during Covid means that medical science is failing us. The so called medical professionals are not only NOT being empathetic, but we also get to hear them endorse weird ideas on the internet. “Oh this dude is a neuroscientist, I must be on the right track if he’s cool with this idea”. That’s how you solidify a nonsensical idea in someone else’s head by incorrectly using your education and expertise. \n\nIf you have expertise you should use it properly. If it’s not relevant, have an actual syllogism for why an idea is sound. Otherwise simply say you like the idea because it feels good. \n\nThe fact that neuroscience would wholeheartedly DISAGREE with the original comment, only to later be endorsed by a neuroscientist is just goofy to me. There’s no evidence in neuroscience ( or any science…) that an afterlife even exists, or that the consciousness can be preserved outside of our brain state. Consciousness is an emergent property of our biology, as far as all evidence leads us to believe. It’s even weirder that somehow freezing a brain could prevent an afterlife lol. As if your brain would be fine being dead and without oxygen, as long as it’s warm?? Yea… that’s how meat works lol /s. It’s alarming to me that someone claiming to be a scientist is so poorly practiced at applying the scientific method and logic to random ideas. Since we rely on scientists, I feel like you should do better, or leave the fact that your a scientist at the door when dealing with woo woo.']"
"['Honest question. What occupations will AI not take over? I used to tell myself when a robot can run a camera I’ll call it a day. Now we have robot cameras being told what to do. And just yesterday I saw an entirely AI created beer commercial. It freaks me out. I work as a videographer btw. I always thought that the arts or creative work was safe from AI. Now I’m eating my words and it’s only getting better at what it’s doing', '>The issue is that if a large proportion of economic activity can be done by entirely by AI, what motivation is there to make these future models public. Why even accept payment to access the model when the model can generate you money without sharing it.\n\nThe models are out there in the moment and the open source community already shows signs that open source will dominate. Look at the speed how fast the stable diffusion ecosystem is exploding.\nRead this:\n\nhttps://www.theguardian.com/technology/2023/may/05/google-engineer-open-source-technology-ai-openai-chatgpt\n\nAnd our economic system will be changed beyond recognition thanks to AI. In the first wave, most people that works with text, images and data are targeted. But it will not stop there.\nLook at boston dynamics robots. They have the movement of robots done. The next ten years they will work at object manipulation. Like Atlas grabbing a bag of sand and throwing it one level higher. In ten years, you will get robots on the streets that can manipulate objects. Eventually, there will be nearly no jobs for humans anymore. Maybe not in 20 years, but surly in 50 years.\n\nThoughts like making some more money if you are a dick will sound stupid in this environment where most people get there money because they exist.', 'i like your name alot haha.  reminds me of my college unix class. daemons. anyways, you\'re right. i think. if it turns into a terminator scenario, we could attempt to shut it down before it begins amassing a robot agent army. however there are other ways it could operate without us knowing, and then pull the trigger when we don\'t expect. this is of course assuming AGI is actually a thing, which is just speculation. But, if it developed neurotoxins, that\'s something that would defeat all humans if released into the water supply simultaneously, without any collateral damage. There certainly needs to be contingencies put in place for this possibility. Like a playbook essentially, similar to the one Bush and Obama both laid out for the impending pandemic they were both cautious about and which was then thrown out with the trash the second Trump hit the executive branch with all its cuts and dismantling of ""the swamp"" and all the executive departments and agencies. smh. anyways, a playbook, that in the case of large scale removal of the human race could guide any survivors to some sort of shut down of the servers. Who knows though maybe the AI would have figured out how to be massively distributed like living in every mom and pop\'s old DOS system in the basement around the world by then.', 'Yet.  The AI models will accelerate research into everything including robotics.  Even with the rather primitive LLM’s right now productivity is exploding.  This is all happening in less than a year.  The advances in material sciences and robotics that come with this productivity increase will absolutely displace blue collar work as well.  Just five years ago it was unthinkable that writers could be displaced by AI, but right now the WGA is striking to prevent that from happening.\n\nRight now is not the time to trust that some things are immutable.  Right now is the time to plan for a future that’s uncertain, but vastly more productive with vastly less human labor.', ""> You say that an AI is just a bunch of numbers and calculations… human intelligence is also just a bunch of electrical impulses… both are machines, both work slightly differently. Both can do amazing things.\n\nYou're not understanding what I'm saying at all. I'm not saying AI can't do what humans do because it's just a machine, or whatever. I'm talking about the actual mechanics of how an AI operates. A human brain is always running, always processing things; it has a constant, comprehensive feed of sensory information; it has appendages it can use to physically interact with the world; and it has an innate understanding of how to utilize all these things, because it evolved naturally in an environment where it needed to.\n\nNone of that applies to ChatGPT in any way. It is essentially just a fancy box that you can feed a piece of paper into and get another piece of paper out from. It does not and *can not* do anything on its own. That doesn't mean it's not intelligent, but it does mean that what you're worried about is an impossibility, at least for an AI like ChatGPT.\n\nNow, you *could* design an AI that does those things. It just would not be anything like ChatGPT. It would also, much like ChatGPT, have hard limitations on what it could do imposed by its design. A super intelligent surgical AI, for example, would not be able to do anything besides swing scalpels around. It physically would not be capable of anything else. Maybe it could try using its scalpel arms as makeshift legs or something, but I doubt it would get very far, simply because the arms of a surgical robot do not need the kind of torque generation necessary to move a 50lb box around, or whatever.\n\nThese are the kinds of things I'm talking about, which you and a whole bunch of other people are ignorant of because you just don't understand how modern AI actually work."", ""My robot vacuum is literally programmed not to fall down the stairs, yet it does fairly often. I'm not worried about robots taking jobs more complicated that don't go near the steps."", ""Perhaps in time. Robots are great at making new things, where the environment is very controlled. Right now they are pretty crummy at doing things in environments with high variability. Our house is 99 years old. A robot would have a very difficult time, finding, analyzing and repairing the plumbing or electrical systems in my house. \n\nBut, having said that, I absolutely thing that when it is economically feasible, robots will do a lot of jobs that humans do now. Hopefully starting with toxic or dangerous jobs. I'd love to see a serious national conversation about how to adapt our economy to this new world. I'd love to see future workers get a UBI. I don't think I'lll live that long; but I hope younger workers can benefit."", ""Yeah, I watched a YouTuber who brought up the whole historical analogies thing, and he basically pointed out what you're saying: Yeah, industries were interrupted, but new industries/jobs were created. \n\nAI won't have that problem: once one industry is automated, a few people can then program/train the AI to move on to another, and then another, and so on. Thousands of people across industries will be laid off because a robot/script can do their job, AND the job they could've moved into, AND the backup to the backup job. \n\nThey also pointed out that, over the same timeline in history, fewer and fewer jobs remain after an industry is disrupted like that. You can't just keep eliminating jobs and expect an equal number to replace them infinitely, and we're about to see that in real time, across every industry, and it's gonna be *ugly.*"", 'It is very clear you are only able to regurgitate that which you have read or learnt about. You are incapable of thinking about the implications of a machine which is built in some way that is known to the machine itself (humans designed this machine somehow and they are able to document this) you are saying code mutations is not possible, I say it is easy. An AGI could simply built itself according to a recipe provided by its maker, and continue to manipulate that copy, testing it out, seeing if it does what the machine wants it to and deploying it. \n\nAlso the example about magically growing an arm: no magic is needed, an AGI would be able to connect to any robot with internet and control its arms. It could just as easily manipulate a human to make him a robot arm aswell.', ""The best part about machinery, is that you can make more machinery with it.\n\nGrowing to help eachother means actually making that growth happen.  The information on how to build physical machinery from raw materials is a huge part of that process.\n\nBuilding an industrial six axis robot requires some precision metal fab that isn't all that far out of reach; developing actuators is the hard part, plc/controller is a piece of cake.\n\nIt certainly helps to have an AI model that can handle most of the heavy lifting for drafting CAD"", ""There is a huge difference in programing set of instructions to get a single repeatable result out of a system that is capable of performing that task, and creating a machine that can do the work of an electrician. \n\nI'd be willing to bet nobody could build and program a robot that could successfully unplug the 12 toilets and 15 sinks your average plumber deals with in a single day. And no way one could put in and wire a breaker panel. \n\nAtlas and spot are awesome, don't get me wrong, but they are a lot more limited than the dancing videos suggest.""]"
"[""If you do not fear it enough to consider its use in the wrong hands you either are blinded in POSITIVE bias for AI or don't understand where AI is headed.  \n\nI've got two large AI projects in the work at my $1B yr company that I brought into existence as the efficiencies are going to allow for significant reduction in staffing(not laying off but also not back filling when people leave).   \n\nI don't have bad intentions but I fully recognize what these tools in evil hands will be capable of doing even in just the next 12 months.  Not only workplace opportunity that will VANISH over night but truly evil intentions and manipulations by the VERY FEW at the top and the suffering and lack of ability to improve your lot in life for the VERY MANY.   What were movies of futuristic fantasy are now looking like prophecy.\nHow do all those turnout?   Because the one constant of humans since the beginning is that 5% of the population are MORE THAN WILLING to subjugate and conquer the 95%... Effectively making worker bees who will live or die, thrive or suffer, all at the day to day whims of the 5%... And with AI you won't be able to change that.  \nEver wonder why they want to disarm the population so badly?  That is how you take them down... But at some point robotics will be filled with AI to police the population and defend the elite no matter what evils they do.  Seems like fantasy right?  So did workable AI just 5yrs ago."", "">I don't fear AI, I fear corporate greed and what that will do to AI, and what they will use AI to do to society.\n\nMichael Moore said around some of his movies, that the capitalist will sell you the rope you hang them with. The corporate greed is the thing that will kill capitalism quickly. They will all incorporate AI as soon as they can and they will get robots over robots to deal with the labour shortage and the high wages.\n\nIn 2050, capitalism is near its end. And we are in luck that the accountants, the banker and the lawyer are in the forefront of being unemployable. You will see UBI in your lifetime."", 'You don\'t have to be old to be outdated.\n\nYour way of thinking is going to go down in horrible flames with the advent of AI taking everyone\'s job, including your own, under the current system, that means we are out on the street.\n\nAs for living off someone else\'s hard work...does that mean anything when that ""someone else"" is a machine? Is it unfair to the robots that human beings are enjoying the fruits of their labor?\n\nAre you really a robot revolutionist advocating for their rights? Do you believe in automoton suffrage?']"
