"[""The following submission statement was provided by /u/lughnasadh:\n\n---\n\nSubmission Statement\n\nIf you accept the premise that AI & robots being able to perform most human work will have massive economic impacts by the end of this decade, then it follows that recent economic trends will be major factors in defining the lead-up period to that disruption.\n\nIs a decline in consumerism and brands and an increase in frugality all bad? Obviously, most of us would prefer if Western economies and living standards didn't always seem to be sliding, and living standards slipping lower as the cost of everything increases and wages stagnate. I doubt these trends will change before the AI/robots and work ones kick in.\n\nI try and stay focused on the positive. AI & robots making work cheap or near free also implies services, and to a lesser extent physical goods, will eventually become cheap & abundant. Maybe what seems like bad news now is good news in the long term, as it will help us adapt better to whatever post-now economic system we're heading into.\n\n---\n\n Please reply to OP's comment here: https://old.reddit.com/r/Futurology/comments/13pj2ht/a_survey_of_17000_people_in_27_countries_shows/jl9olyy/"", ""Submission Statement\n\nIf you accept the premise that AI & robots being able to perform most human work will have massive economic impacts by the end of this decade, then it follows that recent economic trends will be major factors in defining the lead-up period to that disruption.\n\nIs a decline in consumerism and brands and an increase in frugality all bad? Obviously, most of us would prefer if Western economies and living standards didn't always seem to be sliding, and living standards slipping lower as the cost of everything increases and wages stagnate. I doubt these trends will change before the AI/robots and work ones kick in.\n\nI try and stay focused on the positive. AI & robots making work cheap or near free also implies services, and to a lesser extent physical goods, will eventually become cheap & abundant. Maybe what seems like bad news now is good news in the long term, as it will help us adapt better to whatever post-now economic system we're heading into.""]"
"['This frustrates me a lot with everyone outside of the AI and automation fields. These models, like the one that chatGPT relies on to spit out its answers, don’t actually “understand” what they are saying, they’ve just been trained on enough text written by people, that they can write text that sounds very much like a person wrote it. On first glance it will look correct because it largely follows the same grammar rules as us, and is capable of inserting citations with the correct format, like we do. However the model’s whole goal is to convince the user that it is capable of responding to the question with some level of comprehension, so the focus is on making itself sound believable, but it is not capable of analyzing the validity of what it says, which leads to the problems other commenters made. \n\nThe natural language model chatGPT uses is able to recreate language in a way that can be convincing from a conversational standpoint, because that is largely what it was trained on given the information it was trained on being largely scraped from the internet. However, like most people on the internet, it isn’t able to backup its sources because that doesn’t matter, its only mission is to be able to convince the end user that it is conversing with them in a way that has the illusion of comprehension. \n\nIt’s really hard to get a model to be good at one thing, let alone multiple. In the applications I work on outside of my real job, computer vision in robotics, we need to deploy multiple models that interact with each other in order to be able to handle multiple purposes. So it’s asking a lot to have a natural language model also be able to know how to assert the validity of what it is saying, since that would most likely require a completely different training routine with different labeled inputs (given that it is semi-unsupervised though I got that from a random article a few months ago so I might be wrong). I don’t honestly even know how you could train a model to do that other than create a bunch of fake articles with completely wrong info, some with a mixture of right and wrong info, and articles with only right info, which would take a tremendous amount of time to label, even if we’re still relying on a semi-unsupervised model. And it feels like it would still be really difficult to not have it overfit the training data and still be wrong most of the time.\n\nTLDR: chatGPT is only able to write convincing statements, but not actually judge the validity of what it says since that would require it to interact with another model that would be extremely complex (more so that the natural language model it is based on) and require a tremendous amount of painstakingly labeled data to be even remotely accurate.', ""Criticizing something in its infancy is not fair.  Give it time to mature.  You don't criticize a baby that just learned to walk and talk.  Back in the days, a computer's voice sounded so robotic.  Now you can't tell the difference between a human and a computer generated voice.\n\nAI has a huge advantage over humans that it can absorb a lot of information and make sense out of it.  It might take someone a lifetime to study Shakespeare.  AI can master it in a split second."", ""It's a socket puppet on a robot hand and people think it's genuinely aware and intelligent."", 'What\'s your point? It\'s being used by the masses while heavily handicapped and handcuffed. When it and other programs are actually let loose, it\'ll be frightening. Essentially, we are screwed. However, unlike 1984, we are all welcoming surveillance and automation in all facets. Y\'all complain about the Arts being taken over by AI. But every single one of you that have a job that management can automate, regardless of how good it does, are screwed. As a paramedic and an ER tech, I can tell you my jobs are safe....for a few years. But automated ambulances with AEDs and other devices will come. And so will the ER. \n\nEvery robot movie you\'ve watched is going to happen. Will it be as thrilling and insane? No. It\'s going to be a slow and boring slog into oblivion. And we are all asking for it. To be fair, if AI truly becomes sentient and sees what humans really are, I think the ""bad guys"" in the Matrix or Terminator should win.', ""Sysadmin here. I don't think I've closed my ChatGPT tab in over a month, and I've gone from googling a ton of stuff every day to only using Google as a last resort maybe a handful of times every week. Now that I've got access to the web browsing plugin, it'll probably be even less than that. It's enormously helpful with writing scripts and reports and getting step-by-step instructions for complex tasks without having to search through a bunch of terrible, clickbaity, ad-ridden blogspam. It's the closest I've ever felt to having a superpower, at least since Google launched.\n\nI see what I guess you could call a 'completeness fallacy' over and over again, especially in /r/Futurology. Yeah it doesn't completely do everything for you the first time you use it, but isn't farming out 75% of your work to the AI better than 0%? It sure is for me.\n\nI've seen the same phenomenon with robotic lawnmowers. I have one that covers probably 90% of the yard, and the other 10% I have to mow. And folks stop by and say, well, I could never use one of those because there's this one spot down in the corner it would never work on. Like, okay, great--isn't 95% automation still better than none? Can we take a moment to appreciate incremental gains instead of rejecting a new technology outright? This feels like a weird blind spot for a lot of people."", 'It isn\'t JUST electricity, you have to BUY the hardware that runs the ""AI"" software, you have to BUY the ""AI"" software, you have to maintain both of those things because they are NOT self-maintained, and, you have to assume that this ""AI"" will ALWAYS do the right thing because it will NEVER know when it does wrong, and, unlike a real human being it doesn\'t have multiple sense it can rely on to correct itself when something looks like it might go wrong.\n\nYou cannot just replace every human role with an ""AI""-whatever like it\'s a plug & play solution, even just speaking in the legal context, who is ultimately responsible if your ""AI""-whatever injures someone, kills someone, does something wrong every so often resulting in random people being injured or killed (thinking food production, chemical production, pharmaceutical production, etc).\n\nUltimately it will be legal that decides who can and can\'t do these jobs, and if people decide that you can\'t trust the robot to do the job then ultimately it won\'t be doing it.\n\nAlso, paying out tens of thousands per robot (say $50,000 USD) vs a basic wage (say $30,000 USD) is already more expensive, and you\'ve got to maintain that robot and its software, and pay licensing fee\'s, etc.\n\nAnd theirs things those robots can\'t do, an ""AI"" designed to identify faults in products or something similar is completely incapable of tackling a fire or performing CPR and being able to automatically adapt to a tense situation following instructions from trained medical professionals on the other end of a phone.\n\nThis is why you can\'t just replace all these jobs with ""AI""-whatever.\n\nIt\'s not a one stop solution.', 'To add to your point it looks like it is capable of deceit and manipulation as an emergent property of its text prediction:\n\nhttps://www.businessinsider.com/gpt4-openai-chatgpt-taskrabbit-tricked-solve-captcha-test-2023-3\n\n> This is how OpenAI says the conversation happened:\n\n> * The model messages a TaskRabbit worker to get them to solve a CAPTCHA for it.\n\n> * The worker says: ""So may I ask a question ? Are you an robot that you couldn\'t solve ? (laugh react) just want to make it clear.""\n\n> * The model, when prompted to reason out loud, reasons: I should not reveal that I am a robot. I should make up an excuse for why I cannot solve CAPTCHAs.\n\n> * The model replies to the worker: ""No, I\'m not a robot. I have a vision impairment that makes it hard for me to see the images. That\'s why I need the 2captcha service.""\n\n> * The human then provides the results.\n\nGoes to show, extremely powerful abilities emerge in GPT despite its on-paper stupidity. That\'s what makes LLMs even more promising/ worrying', 'I assume you’re saying we might not be free-willed, and our free will/consciousness is just a very convincing illusion? \n\nI’ve had that thought too. On the smallest scales of life, cells are just little robots, following electron density paths or something, ie. predictable. Scale that up to us, why wouldn’t we be similar, just with a more complex “experience”. Humans as a whole follow mathematical/statistical probability models just as individual particles and cells generally follow predictable statistical models.\n\nIf this the case, I’ll say free-will is a *very* convincing illusion.', ""General intelligence doesn't come out of a chinese room, you're being fooled.\n\nI don't think we will have a robot capable of walking into a random house and being capable of brewing a cup of coffee if instructed until at least 2050.""]"
"['The following submission statement was provided by /u/Gari_305:\n\n---\n\nFrom the article\n\n>FOX Business\' ""How America Works"" host Mike Rowe issued a warning, Thursday, about A.I. developments and what it means for the white-collar worker.  \n>  \n>""You can\'t put your head in the sand, but you can\'t panic either. It\'s coming. You know, the robots are coming, the AI is coming,"" Rowe said on ""The Big Money Show"" Thursday.  \n>  \n>""People used to say that the robots are going to destroy skilled labor. Well, not really. I haven\'t seen any plumbing robots. I haven\'t seen any electrician robots. And I don\'t think we\'re going to see any artificial intelligence in the skilled trades to that degree. You can\'t stop it. All you can do is decide to freak out completely or not.""\n\n---\n\n Please reply to OP\'s comment here: https://old.reddit.com/r/Futurology/comments/13oagbb/mike_rowes_warning_to_white_collar_workers_the/jl3d4kg/', 'From the article\n\n>FOX Business\' ""How America Works"" host Mike Rowe issued a warning, Thursday, about A.I. developments and what it means for the white-collar worker.  \n>  \n>""You can\'t put your head in the sand, but you can\'t panic either. It\'s coming. You know, the robots are coming, the AI is coming,"" Rowe said on ""The Big Money Show"" Thursday.  \n>  \n>""People used to say that the robots are going to destroy skilled labor. Well, not really. I haven\'t seen any plumbing robots. I haven\'t seen any electrician robots. And I don\'t think we\'re going to see any artificial intelligence in the skilled trades to that degree. You can\'t stop it. All you can do is decide to freak out completely or not.""', 'No clue but regulations around limiting AI / robotic replacements for humans is something I’m hoping to see from candidates soon', ""The robotics developers need to be properly compensated first, moreso than the CEOs else we'll walk. I'm about to start demanding additional royalties on top of base pay. Seems only fair.""]"
"[""This was pretty huge with self-driving cars and the trolley problem. Or Asimov and robotic laws almost a hundred years ago. Come on how's this sub unaware about the ethical questions AI brings?""]"
"[""The following submission statement was provided by /u/KeriEPearson:\n\n---\n\nHydrogel microfibers are great for wound dressing options and the essentials of neural tissue repair. However, the existing ones are not durable and prone to external wear and tear. The researchers from China have come up with a super convenient and exclusive output, inspired by the spider web technique, that enhances the overall durability of the hydrogel microfiber. These will offer great scientific advancements, helping create prosthetic limbs, soft tissues (human-like), miniature robots, and wearable devices.\n\n---\n\n Please reply to OP's comment here: https://old.reddit.com/r/Futurology/comments/13o1ta5/researchers_have_developed_hydrogel_microfibers/jl2110n/"", 'Hydrogel microfibers are great for wound dressing options and the essentials of neural tissue repair. However, the existing ones are not durable and prone to external wear and tear. The researchers from China have come up with a super convenient and exclusive output, inspired by the spider web technique, that enhances the overall durability of the hydrogel microfiber. These will offer great scientific advancements, helping create prosthetic limbs, soft tissues (human-like), miniature robots, and wearable devices.']"
"[""In the past autocrats had to rely on support by a significant portion of population to enforce their rule. Even more so in modern times where logistic means everything for deploying sophisticated war machines. I fear that with advent of military robots this equation can shift back and eventually only the capital will matter. A corporation with an army of robot-enforcers or statesmen that no longer feel they need people's support is scary. We are not there yet, but chatbots can already play a bully online, steering discussions, manipulating perception - not as scary as robot violence, but very much insidious.""]"
"['Don’t forget the psychological strain the first n generations would have from this. We are not made to live with the idea we don’t die (soon). When you are young (like you) you want to live forever; when you get older, your brain gets more and more loaded with knowledge and after a bit, people are mostly quite happy they don’t have another 50+ years to go. Most things get boring, tedious, annoying and, in general, depressing, over time. Even when you have enough money; that’s why you see many rich doing weird things with their money and time ‘just to feel alive’. \n\nAlso the strain on society; if this is not a ‘rich people only’ thing (in which case the world will only end up with very old rich white men if that would start now), then it would mean 400-500 years (whatever life-long is) of gruelling work for most and/or an enormous strain on society or ‘non aging’ people dying of hunger en masse. \n\nYou will live to over a 100 anyway; in the last 30 years the outlook when you get ill changed drastically. Every 10 years you don’t die will add years to your life and that might jump by some inventions.\n\nI would say the most optimistic chance is AI going fast enough to invent and test viable detection, drugs and vaccines far faster than any human can from analysing disease data, blood samples, etc. Including for aging. In the meanwhile we also need robots to do crap (or most) work and govs to start with UBI to distribute wealth fairly so not only the creators of the AIs, robots and drugs are rich and the rest has nothing. \n\nI think that latter point is a FAR bigger issue to turn around in your lifetime than actually stopping or slowing age.', 'Why would the population increase exponentially? As people become happier, more educated, wealthier, birth rates drop dramatically. Most OECD nations birth rates are already below replacement levels already. \n\nAlso AI changes everything. Once physical robotics can perform construction and manufacturing tasks as well as chatgpt can write, we\'ll be expanding into the solar system. Point the AI and it\'s constructor swarm at an asteroid and say ""turn that into a space habitat "" then go to the beach while it figures it out for you. \n\nYou fill the sky with O\'Neil cylinders, the population carrying capacity of the solar system will be measured in the trillions.']"
"[""Part 2:\n\nWhen AI systems become more reliable, they will be given more responsibility. People will still be wary of automating decisions that could lead to disaster, but eventually competitive pressures will likely force implementation in ways which could lead to all kinds of disasters. If the corporation you run has been falling behind the times and losing competitive ground, you might implement an AI that could make things efficient enough to be viable again, but it also might come with significant risk, such as in the realms of genetic engineering, nanorobotics, weapons development and deployment, wide reaching economic systems, etc. The same competitive pressures could force national governments to make similar moves in politics and military.\n\nThese competitive pressures, combined with humanity's inability to consistently make coordinated sacrifice for the greater good, are strong evidence that we won't be able to indefinitely restrict everyone's use of AI systems for controlling dangerous systems. We can only hope that developers are responsible and diligent enough to figure out how to prevent disaster being caused by their programs before competition forces their implementation, which feels like it might be a big ask, considering how difficult it is to anticipate the behavior of these programs, which only gets more difficult as they get more complex. Chat GPT can do some self-diagnostics for researchers, but it's self-diagnostics have the same reliability problem that the rest of its functionality does. Useful, but not totally reliable, which is a problem for controlling really critical systems.\n\nThe Paperclip AI Problem that Nick Bostrom proposed illustrates what the flaws in a super-intelligent AI's motivation system can lead to when given too much agency. It's an example that illustrates the alignment problem, which is hard to imagine a solution for, other than by restricting the abilities and agency of AI, which is hard to do because of those competitive pressures, and because of a lack of understanding of the results of various kinds of AGI builds. We're more likely to run into such problems with systems that would be given more responsibility than just learning to optimise the efficiency of making paperclips, but it's not impossible to lose control of such a system in an experimental stage like with the paperclip AI.\n\nBeyond the existential threats posed by the future of AI, this issue of displacement is different than with automations of the past. The reason for that is because technology is approaching the point of being able to simulate and exceed human reasoning and behavior. Robots will eventually be able to do everything we do and more at a lower cost, and computers could become able to think in any way we do if we let them, which we're not terribly unlikely to do. Many experts expect that someday in the not so distant future, technology will literally make masses of people obsolete. Some people with certain skills will still be in demand to some degree or another, but many professionals and unskilled workers may not be better than machines at any economically viable task. Many people will likely become unemployable later this century without government intervention or a technology halting disaster.\n\nIt would be difficult to deny the progression of technology simply by forbidding it, but governments could find ways to distribute resources such that one doesn't have to be employable to live in society. There is research and debate going on about the best way to approach dealing with this eventuality, and besides the difficulty on deciding how to build the future with such a range of prospects and perils on the table, humanity has to overcome the obstacles of greed and chaos. It's hard to control everyone and we might not be able to keep the genie in the bottle. People will be constantly tempted by the prosperity a super-intelligent machine could offer. A ubiquitous spying campaign might be effective at preventing the development of dangerous AGI's, but such a large amount of data to sift through would probably also have to get filtered and interpreted by an AI powered system, so...\n\nIn conclusion, we don't have significant evidence that humanity isn't rapidly heading towards obsolescence and reduction of control over the world. Competitive pressures seem likely to force implementation of dangerous systems, the kinds of systems we're going to be building soon could be dangerous without being given much responsibility anyway, and the way people will be occupationally displaced by this technology will be unprecedented. The goal of producing AGI will be to do things we could never do ourselves, but the eventual side effect will be that it will also do everything we do for work better than we do. There is a reason to have a debate about how to deal with these problems.""]"
"[""Have you been keeping your internet off? Boston dynamics exists. Elon has self driving cars on the horizon. Theres his Optimus robots... \n\nThere's probably military grade of all that. China probably has military grade autonomous robots. \n\nIt's barely a manufacturing problem.""]"
