"['Disgusting article honestly, and just poorly written.\n\n“Let’s embrace AI taking the role of artists, it can be just as if not more creative than humans (as long as a human gives it a creative enough prompt)” \n\nJust the whole idea of using AI to take not just the menial jobs as it was meant to, but also the jobs that many are genuinely passionate about is just wretched. This is most lame, yet just as disturbing robotic apocalypse imaginable', 'I didn’t say apocalypse, as I said I’m not referencing the article, I’m not even taking about AI taking over or becoming sentient or any of that Sci-Fi nonsense of robots trying to kill us and taking over, I am talking about automation and endless efficiency and the effect it will have in the job and our current world in general (and eventually our own minds, I do believe this revolution will happen in our life time when a lot of people lose their jobs because a fraction of the same workforce can do the same job using these tools, that fraction of people is the ones who get these “new type of jobs” but those will also inevitably will go to.\n\nPeople keep dismissing the impact of this because when the threats of AI are mentioned images of movies and bad robots immediately come to mind, instead of tools that essentially render a large and significant portion of the population redundant from the work force and when that happens the economical system itself collapses.\n\nThe cost effectiveness part of the equation is a matter of time, it is also not something that everyone needs, you just need one or two major service providers that provide these tools as a service to have a huge impact, you don’t need your own server farm or ai models to make use of this, just pay for the service which is a lot cheaper than a larger work force.', 'For real. People don\'t understand how alarmingly quick AI is going to grow and quote me on this because it IS going to happen: People are going to lose their jobs to AI robots because they can learn much faster, plus they can keep them running 24/7. CEO\'s WILL choose robots over humans, all in the name of profit. And it IS already happening as we speak. For example, 20 million automation jobs are going to be lost to automation by 2030.\n\nNvidia said in the next 10 years, AI is going to be a million more times advanced than it is now, and with supercomputers, this is going to be even worse.\n\nAI needs regulation, and human life is in serious danger. And I don\'t mean in the way of rebelling AI robots, no. This is going to be a slow, structural decline of the society we\'ve built so far. First, it\'s the manual labor folks. Then, once we can automate and learn AI how to manage data entry/office jobs, it\'s the white collar folks.\n\nAnd they\'re not gonna compensate these folks. They don\'t care. Back then in the automation phase nobody got anything. You just get fired and that\'s it.\n\nYou can ""nah, AI isn\'t growing that quick besides it\'s not usable right now it\'s so inefficient."" me all you want, but go tell that to computers. Tell that to the internet. Tell that to mobile phones. They ALL got the same comments in the beginning, and look at where we are now.\n\nEven Stephen Hawking warned us about it before he died. We need to regulate this because it is structurally endangering humanity, where only the elite who own companies are going to be left. (Even though I won\'t be surprised if this causes a serious civil war against the rich once they\'ve claimed all wealth for themselves. Think full on raids to kill people like Elon or Bezos.)\n\nStephen Hawking also specifically stated it\'s either the best thing or the worst thing that\'s ever going to happen to us. But if we keep valueing money over people like we are now, it IS going to be the worst thing.', ""Just FYI; in Japan they're teaching the robots to self-repair, and I've heard cases of people make robots that fix other robots, essentially creating a perfect loop of redundancy so that no robot will ever be down.\n\nWill there always be jobs? Yes. But the better question is; WILL you get said scarce jobs, if you don't have the right certifications, don't know if it's even worth learning for said jobs if there's just another AI around the corner who can take over your job 20x faster than a human being can, and, if it really ONLY can be a human being; you'd be competing against hundreds of other applicants.\n\nYou are going to run out of your money eventually. And government funds can only give out so much to people as joblessness increases.""]"
"['I\'m not an authority on this. I know for sure that people mean different thing by free will and there is no common position that all ""professional"" philosophers agree on.\n\nI think for example Dan Dennet believes in a will that is both free and determined, like you do. The Standford Encyclopedia for Philosophy has a [well written overview](https://plato.stanford.edu/entries/freewill/).\n\nI agree that having reasons for decisions is a good thing. I wouldn\'t want my desires and choices to be arbitrary. The physical representation of the reasons of my choices are the deterministic processes in my brain.\n\nSpeaking of deterministic: Physicists actually say that reality is *not* deterministic. Randomness exists. It\'s about quantum stuff and many philosophers and esoterics talk about it without understanding it completely.\n\n> Also I kinda missed why quantum randomness would be different from other types of randomness.\n\nWhen you throw a dice exactly the same way under the same conditions, it will always come up on the same side. There are robots who do this. A dice roll is only called ""random"", because it\'s *practically* unpredictable to the general person.\n\nIn the quantum world, there are things that are truly *principally* unpredictable. There are no details that you can look at closer to make a prediction and for some reason they know that they will never will be able to. I\'m not a physicist, so I might have misunderstood that.\n\n[Hidden Variable Theory](https://en.m.wikipedia.org/wiki/Hidden-variable_theory)\n\n> Bell\'s theorem and subsequent experiments would later show that local hidden variables (a way for finding a complete description of reality) of certain types are impossible. One well-known non-local theory is the De Broglie–Bohm theory.']"
"['To me religions are a bunch of cobbled together memes that try to convince monkeys to acts like robots so they can escape a malthusian crisis. I don’t believe the details of any of these religions, but I’ve noticed ever spiritual place and ritual had the same effect of helping people to reprogram their own minds. The biggest 4~5 have sort of all proven themselves roughly equal at this I guess. They’ve all got some blood on their hands for when they went off the rails too']"
"['>But what’s free about that?\n\nI\'m sure there are other definitions, but I use something like free will is about ""the ability to make voluntary actions in line with your desires free from external coercion/influence"".\n\nFree will is key in morality and justice, so I like to understand how the courts define and use it. Lets use a real life example of how the Supreme Court considers free will.\n\n>It is a principle of fundamental justice that only voluntary conduct – behaviour that is the product of a free will and controlled body, unhindered by external constraints – should attract the penalty and stigma of criminal liability.  \n>  \n>[https://scc-csc.lexum.com/scc-csc/scc-csc/en/item/1861/index.do](https://scc-csc.lexum.com/scc-csc/scc-csc/en/item/1861/index.do)\n\nIn the case of R. v. Ruzic\n\n>The accused had been coerced by an individual in Colombia to smuggle cocaine into the United States.  He was told that if he did not comply, his wife and child in Colombia would be harmed.\n\nThe Supreme Court found that he didn\'t smuggle the cocaine of his own free will. He didn\'t do it in line with his desires free from external coercion. Hence they were found innocent.\n\nCompare that to the average case of smuggling where someone wants to make some money and isn\'t coerced into doing it. If they smuggle drugs then they did it of their own ""free will"" and would likely be found guilty.\n\nSo in one example the person had what the courts say is free will and not in the other. \n\n&#x200B;\n\n>What’s the difference between you acting on your desires and a robot acting on its programming?\n\nWell I would say a person is just a really complicated robot, so there isn\'t anything fundamentally different apart from complexity.', '>This doesn’t seem like a logical argument to me. It seems like you’re just saying humans tend to believe we have free will, and our society is based upon that assumption.\n\nI\'m saying that humans use the compatibilist definition of free will. Hence it makes sense to talk about compatibilist free will rather than libertarian free will. \n\nI\'m saying it\'s illogical to use the incoherent concept of libertarian free will. \n\n>Where would we draw the line between free will and compulsion? \n\nIt would depend on the facts and I like to look at the legal system, which does this all the time. \n\nIn cases like R. v. Ruzic, they looked at the facts and determined they were coerced and hence didn\'t have free will. \n\nIn the case of Powell v Texas, where they tried a defence that it wasn\'t of their own free will since they were an alcoholic. While this argument shows they didn\'t have libertarian freewill. The courts didn\'t accept this argument and it was found they did have free will. So they did distinguish between free will and compulsion in this case. \n\n>It has to be arbitrary\n\nJust like pretty much every high level concept. Even the concept of ""life"" is arbitrary with many blurred lines. But just because the concept of life is arbitrary doesn\'t mean it isn\'t useful or that we can\'t apply in the context of humans. \n\n>, just like you noted about a robot’s desires. An automaton desires nothing other than following its programming, so anything a robot does successfully would be an exercise of free will. But I don’t think anybody would actually argue that, they’d argue it’s an exercise of the programmer’s free will. Why is it different for us just because our programming isn’t apparent?\n\n&#x200B;\n\n>Why is it different for us just because our programming isn’t apparent?\n\nMaybe that\'s the main difference. We aren\'t programmed with a clear simple goal of killing someone, whereas the robot was. \n\nIf you change the example of just making the angry and violent, then if the robot following these goals kills someone, I think it is fairly similar to the human case.']"
"['As if we live in a culture that even remotely interested in the kind of mental and physical discipline to answer such questions throught direct experience.\n\nLook at every one of the people on this panel- all scientists, DEEPLY entrenched in the dogmatic view of materialist reality. Academia and academics are profoundly colonized.\n\nThis entire culture\'s attitude is identical to the stuff in this thread that we\'re genetically programmed robots, basically.\n\nThat\'s just one of Rupert Sheldrake\'s Ten Dogmas of Science. Science is broken in terms of our ability to see beyond science-as-method and science-as-worldview-with-certain-kinds-of-conclusions-and-certain-types-of-allowable-evidence. We\'ve broken science in many ways, and we need to break out of the dogmatic thinking we\'re enslaved to.\n\nEven the title ""until we agree"" shows what Terence McKenna said:\n\n*“What we call reality is in fact nothing more than a culturally sanctioned and linguistically reinforced hallucination.”*\n\nOne NO ONE is willing to go outside of to find answers, and those who do are NOT thought to come back with Evidence, but some random subjective experience, like going to Disneyland.\n\nIn such a culture, the questions we\'re asking are impossible to agree upon without a lot more people having had a lot more direct experience with how fundamental consciousness is.\n\nWhen you ARE aware of how fundamental it is, then the term consciousness stops being some other object and it turns into something inexpressible with profound implications and limitations and humility about what CAN be talked about or socially agreed upon.\n\nWe throw around quips byu Einstein like ""We cannot solve our problems with the same thinking we used when we created them."" but then we ACT like we can.\n\nWe\'re all too willing to spend decades of time with thousands of people spending billions on some expensive object to smash particles together but you couldn\'t find an equal number of scientists willing to spend that same time meditating ot exploring consciousness as it has been done for thousands of years.\n\nAnd they won\'t do that for the same reason Rupert Sheldrake\'s metrologists wouldn\'t accept that the speed of light could be variable ""because it\'s a constant"", no reason to look for changes.\n\n*“You are an explorer, and you represent our species, and the greatest good you can do is to bring back a new idea, because our world is endangered by the absence of good ideas. Our world is in crisis because of the absence of consciousness.”*\n\nAnd yet almost no one is willing to actually look for the answers beyond what the rigid and abusive orthodoxy has deemed acceptable.\n\nIt\'s ironic and sad that we\'re all too willing to look for consciousness in machines and not ourselves. How would we even know what we\'re looking for?\n\nMachines aren\'t complex enough to have REAL consciousness, but they will increasingly become better at performing complex tasks until we can\'t tell the difference between them and in this narrow way we\'re allowed to know ourselves.\n\nI for one know that machines CANNOT become conscious, because I\'ve had enough experience with what that means to know they can\'t.\n\nBernardo\'s argument about the FSM does the typical burden shifting memetic skepticism that IS THE PROBLEM. Until we can see that forcing people into an arbitrary framing that ""everyone with a theory needs to show why they should be taken seriously"" is a SOCIAL barrier, not a scientific one.\n\nSpeaking of bias, the modernity bias also blocks us from grasping why all previous pre-colonized cultures understood consciousness as noumenon instead of phenomenon and yet all these people are claiming that it is phenomenon. Are we so much better than those cultures or are we just biased with colonization and skepticism?\n\nWe often forget how much we compromise to make things utilitarian. It\'s so prevalent I think of it as a bias, but having said that, Donald Hoffman\'s point about assuming consciousness booting up materialist things makes more sense practically and toward explaining things in a utilitarian way.', 'Bernardo Castrup believes only biological beings are conscious, but I don\'t get why. I agree more with Susan Schneider that we should be humble.\n\nHe says a bottle or car (and, I assume, a robot) is *not even* a thing - much less a conscious thing. It\'s difficult to say where a car starts and stops. Are the wheels part of the car? Is the gasoline part of the car? Is the driver or even the road part of the car? He says perceiving the car as ""a thing"" is just a pragmatic language thing and I agree so far.\n\nBut doesn\'t the same apply to humans? What is part of a human and what is not? The question of when a human should be considered dead was shifted mutliple times over history. I would say that it\'s also ""just"" a pragmatic language thing to call something a living human being.\n\nI would say it\'s not useful to make a distincion between pragmatic language things or ""nouns"" and actual, real things. Just call the nouns ""real"" as well. If a car runs me over, it\'s real enough.\n\nAnd he said something about metabolism. What\'s that? Burning carbon for energy? A car does that as well.', 'Yeah, their consciousness is absolutely well-established. If beings such as dogs and non-human primates aren\'t conscious, then that word doesn\'t mean anything at all. Even insects with semi-robotic behaviour, like ants, display fairly notable signs of consciousness.\n\nYou can\'t ever know for sure whether other beings are conscious, but that line of logic could be applied to other humans as well. Seems more logical to presume that all beings that share human-like behavioural tendencies are conscious to some extent, rather than assuming that you are the only conscious agent in the whole universe and that everything else is either a rock or an NPC.\n\nThe potential extents of cognitive ability and self-awareness, in each individual species, are still up for debate, but these are empirical inquiries that science should eventually solve with great precision.\n\nFor example, we already know that most - if not all - of our fellow primates are intelligent and self-aware enough to tell (perhaps \'visualise\' would be more accurate here) themselves stories about their own existence, as a kind of inner \'dialogue\' - just like our minds tend to operate - but their inability to develop a proper semantic language, and their suboptimal social structures, hinder their ability to utilise the full capacity of their brains. Their neurological system ceased evolving at a very awkward stage because their physiology and environment gradually stopped applying selective pressure and started favouring other traits.\n\nThe Homos genus were evidently super lucky to retain that selective pressure. Our ability to make coherent noises was apparently one of the driving factors, it was a great asset that pushed evolution to select for genes that enhanced it or otherwise played well with it (mainly our gigantic brains).\n\nIf we ever successfully domesticate a fellow primate, I reckon they\'d make for one hell of a sidekick. They just need to be somehow made aware of the fact that they are way smarter than they give themselves credit - definitely smarter than lobbing feces and constantly going apeshit for no discernable reason. Not necessarily suggesting that it would be wise to attempt such an experiment, mind you.\n\n\nConsciousness itself is more debatable when you start talking about plants, fungi, bacteria etc.\n\nIt may initially seem unfathomable that a bacterium could be conscious, in any possible way. When you really think about it, though, the question becomes why *wouldn\'t* it be conscious? It doesn\'t seem like there is any secret sauce that marks the emergence of consciousness, so it perhaps might be a spectrum that emerges subtly and gradually, starting from the very beginning. Not quite sure the ""beginning"" of what, though.\n\nIf I had to guess? Well, we still don\'t understand how biological life emerges, so there is a pretty good chance that the two phenomena are at least loosely linked. I\'m inclined to agree that discerning whether an AI could ever be really conscious or not, is a seemingly impossible task, until we first understand how consciousness emerges in biological life. We probably ought to start there before getting involved into something we don\'t understand at all.\n\nEdit: okay, no more edits, I promise.', ""You said that humans are probably incapable of discovering a conscious equal to their own.\n\nI provided a scenario how a human with prejudice could accept a robot as an equal. Like - there are movies where a someone doesn't accept women as equals, but they respect a certain mystery knight who wears a helmet. Then it turns out the knight was a woman and now they are respected.""]"
"['What\'s the point in distinguishing what you call ""unintelligent"" robot and us? Difference is in its complexity and how exactly each of them work, and that\'s minutia. Neither of them can defy what it is or the laws of the universe, and exist only as the process of the larger mechanism. What you are gonna choose is already decided by things before and outside of you.\nAnd I think I\'ve gave my answer to that question, even if it wasn\'t perfect. The line I draw is between the conscious thinking part/its experience, preferences, etc. and the rest, because that\'s the part that thinks, feels and talks in response to the universe/its subjective experiences. It doesn\'t have to be immaterial for it to know whether it experiences ridiculous drives as a result of the body it\'s a part of.\n\nAnd you haven\'t given an answer to the simple question of ""how would it feel to be the person in that state"" and if you\'d call that experience ""freedom worth wanting"" or whatever. Is it that hard to imagine?\n\nWhat are you but a machine made to do pointless tasks until you are no more? Eat, sleep, think, talk, entertain, all so we can continue to maintain the existence of this silly process. And we can\'t even get out of bed unless we delude ourselves into thinking there\'s some value or point to this farce. We have the capability to examine our own nature of existence, and know if it\'s stupid or not.\n\nIf you decide to respond one last time, just answer the question. How would it feel to be in that state, and would you call that ""exercise of freedom"" or ""freedom worth wanting.""\n\n\n\n\nFor people who might (somehow) read this back and fourth, or in case you revisit this thread, I have a thought experiment for you.\nSuppose I knew how you would react to certain inputs, and said just the right things, so you would respond the way I want you to. You are still deciding what you write using your own knowledge, criteria, etc. And you aren\'t making the choice based on some imminent possibility of harm.\nI only chose words so you\'d pick certain choices.\nWould you call this a free choice?']"
"[""Ill take a stab at trying to help your point as i see it... imagine that the subscribers to this belief are or feel like ants or automatons, or beings or something that are small and inconsequential, and the reducible of all things from to 1 and 0 isn't a large leap of number crunching.  from infinite down to zero, more like something small down to zero (Reduce before reducing)  continuing in the system as the small who feel smallest see it, to work/live struggle to further add to suffering et al would seem unconscionable so long as suffering et al  (you use the perennial trolley problem) would be continuing to grow even as a byproduct of any work or efforts.  \n\nIn this particular zero sum trap... which I take it you seem to find more funny than tangible as a working philosophy (not saying I disagree)... annihilation is like a death wish....  I think a more fair evaluation would be what is annihilated is the effort and motivation to continue contributing to living (which isn't quite a death wish but no less problematic, I hope we can agree).  Like a bug that won't work, or a piece of a system or robot that lies down or spins in place instead of finishing its task/job.  The death of traction, or motive to build or create or add to anything is their illness, and that illness can only be described (to them) as suffering. \n\nWhich is to say the valuation of that philosophy is that its a problem akin to depression or mental illness that probably doesn't need to be laughed away or casually dismissed but Rather dissected carefully like in an autopsy and studied closely.""]"
"['> “A land flowing with milk and honey—desalination and carbon-capture fed by the unlimited energy of Solar-Wind-Battery systems. Agriculture and supply-chain-infrastructure powered by end-to-end automation. Disease and disability mitigated by the confluence of gene-editing and robotics—the possibilities are endless, and the list goes on and on.\n\n> “That itself, is what could be called Utopia; the coming world of our next century—and **any and all who disagree are either deeply pessimistic or simply uninformed…**\n\nCapitalism isn’t going to give us a utopia. For one, capitalism only puts resources towards towards problems that can be monetized. For example, there is a huge incentive *not* to cure diabetes. Insulin is extremely cheap to produce and diabetics have no real choice but to buy. It’s not “stupid” or “uninformed” to suggest that utopia is not right around the capitalist bend or even just that there might be some slight tweaks that could get us there faster.\n\nI think it really comes down to this Dionysian/Apollonian argument. The idea that anybody who suggests compassion is just some envious charlatan who is by definition weaker than some super competent ubermensch is just so full of assumptions. The causal reasoning as to how these resentful leaders with their forgiveness - barf! - and selflessness - yuck! - turn society into Swiss cheese deserves criticism.']"
"[""The roboticist Pentti Haikonen has put forth the idea that natural (and by extension) artificial consciousness hinges on qualia, and that we won't develop said artificial consciousness until we can implement qualia-centric hardware of sufficient complexity. Considering that human wetware functions on a similar premise, i.e. that our conscious existence depends on inter-neural communication that is independent of objectivity, would you think this theory holds water?""]"
