"['>obviously, if you\'ve got a sentient AI that\'s fully capable of feeling emotions it\'s functionally a person\n\nThat\'s a strong conjecture you have here.\n\nMaybe it\'s missing a person\'s connection towards that person. A robot can be repaired or replaced when it stops functioning. I wouldn\'t even think about robots being capable of dying. I think it\'s very hard to construct a hypothetical situation where we value the continued existence of a robot as high as a human life. Maybe when it contains some kind of data that is so important for the continued existence of all of humanity, then we would give it some value. For human selfish reasons.\n\nHas anyone read ""The selfish Gene"" by Richard Dawkins? I consider reading it next.', 'I mean, humans can be replaced when they die, too, when it comes to job functions? I don\'t feel like being replaceable at your job is a defining trait of non-personhood.\n\nI don\'t feel like ""we could build a new robot"" is the defining trait in what makes a robot incapable of death. Robots are incapable of ""death"" because to us death implies more than just incapacity to do a job, it implies the loss of an individual who has unique traits and a personality and an emotional state. You can get a new accountant, or a new grocery store clerk, you can\'t get a new grandma that will be just as good as your current grandma.\n\nIf a robot is sentient, and has a unique emotional state that\'s limited to that robot, and is capable of fully articulating that emotional state, that robot is functionally a person, in terms of the ""loss"", isn\'t it? If you destroy that robot, and all its backups, you can\'t ""replace it"" any more than you can replace any other unique person. You could try to force a new, different robot to go through all the same experiences, but it wouldn\'t grow up the same way or react the same way to all of them, it would be divergent - a new/different person.\n\nThat\'s my gripe - I think that the robot **is** a person by any meaningful definition of person that doesn\'t get into theological mumbo jumbo about souls, or restrict itself to definitions that would make it impossible for aliens to be ""people"" too, for example.', '>Why exactly?\n\nOK let me try to explain how I frame this.\n\n""Would you rather shoot your mother, or a stranger"" - I would rather shoot a stranger. If I\'m forced to kill someone, I\'d rather kill a stranger than my mom.\n\n""Would you rather shoot your mother or five strangers?"" - I\'d still rather kill the strangers. I don\'t know if there\'s a number of strangers you could pick before I\'d rather shoot my mom. I understand this as the idea that people I\'m directly connected to matter more to me.\n\nSo at this point, I\'m agreeing with you so far. We both agree I have a bias toward saving people I know.\n\n""Would you rather shoot one white stranger, or five black strangers?"" (I am a white person, for clarity) - this is where I start equating with the AI question I say is different and worse. If you\'d rather shoot five black people than one white person, because you identify more with white **people** than black **people**, this is where I think the wrongness starts.\n\nI take issue with the idea of ""our own"" being so broadly defined. My mom is ""my own"" and my desire to protect her over strangers is beneficial, but I don\'t think if I defined ""my own"" as ""white humans are better than black humans"" or ""humans from America are better than humans from Europe"", it is equally beneficial. And taken to the extreme, I don\'t think it\'s better when my definition of ""my own"" is ""human babies are more important than robot babies or alien babies"".\n\nI think the bias toward ""our own"" is fine (or morally defensible, or morally acceptable, however you want to say it) in the very small cases, but is not fine when it starts being extrapolated to society wide attitudes or deciding which kinds of strangers deserve your preference. I think that in general the bias toward ""protecting your own"" gets perverted to justify terrible actions on the societal and cultural level, and so you can\'t equate ""protecting my own"" at the individual level with ""protecting my own"" at the level of a culture or whole country or a law governing all of society.', '>Take a baby theres tons of studies done on how the sight and sounds babies make can have a profound effects on our body chemistry especially if its in perceived danger. A pile of mechanical parts is not going to trigger that ingrained reaction.\n\nDoes that mean things that aren\'t babies don\'t deserve empathy?\n\nDoes that mean that human beings who evoke less natural sympathy than babies don\'t deserve to be considered ""people""?\n\n>Are we as humans at fault that evolution has designed us to be wired to place the needs of our species above every others?\n\n""Fault""? Why are we attributing fault to a natural process? Of course it\'s not your FAULT that evolution made us with certain natural traits - humans are violent as fuck, because capacity to inflict violence is valuable - that doesn\'t mean we need to celebrate it and encourage it and we have some kind of philosophical obligation to glorify violence?\n\n>Until we conclusive determine what consciousness and sentience actually are there\'s zero way to determine if a robot is actually sentient or simply executing an elaborate series calculations to determine the reactions that would be expected of a sentient being.\n\nYeah and there\'s zero way to determine you\'re actually sentient, or if you\'re just a pile of baby-protecting instincts? I prefer to err on the side of assuming you are sentient, and there\'s no reason to stop with you, we can just assume anything that\'s demonstrating a certain level of awareness about the world and capacity to interact with the world and reason is sentient.\n\nThe fact that you are lacking an ingrained instinctive reaction that encourages you to protect the rights of a non-human sentient creature is **not** a moral defense for apathetically allowing that non-human sentient creature to die, or giving no shits if it does die.', '>Does that mean things that aren\'t babies don\'t deserve empathy?\n\nNow thats a massive leap in logic that was never implied, honestly if your first reaction is to instantly jump to extreme examples that just shows youre looking for an argument not a discussion. \n\n>Does that mean that human beings who evoke less natural sympathy than babies don\'t deserve to be considered ""people""?\n\nAnother ridiculous outlandish take that common sense should already be able to answer , humans by ""design"" are empathic to many non-human things the huge difference is the level of the reaction.\n\n Lets say you look at a puppy certain parts of your brain activate, chemicals are released you think its cute and get a slight feel good boost. You watch a video showing animals getting slaughtered and screaming in pain again brain activates, chemicals get released you feel disgusted, angry, sad ect ect. \n\nYou watch a car get tossed into a compacter and crushed into a cube your brain goes meh unless you had some sort of sentimental connection to said car it wont trigger an emotional response. \n\n>Yeah and there\'s zero way to determine you\'re actually sentient,  \n\nGo look up the definition of sentience, by every metric of what we currently understand sentience to be humans most certainly have it. You could argue that people with certain neurological disorders or brain damage fail to meet that criteria. However if you yourself believe you\'re sentient then you automatically have to assume that other members of your species have to be as well. \n\n>we can just assume anything that\'s demonstrating a certain level of awareness about the world and capacity to interact with the world\n\n Whats you criteria?\n\nA significantly advanced computer system could be trained to have conversations, pose questions, ponder things ect ect and still be simply going through a complex set of algorithms. \n\nHuman empathy is almost entirely based on our experiences to use a magical scifi example a child raised by robotic parents is going to be biased towards believing that robots displaying complex behaviours is sentient even if it\'s \nsimply programming.\n\n\nThe question of what humans believe is sentient isn\'t as black and white as you seem to think it is.', '>Now thats a massive leap in logic that was never implied, honestly if your first reaction is to instantly jump to extreme examples that just shows youre looking for an argument not a discussion.\n\nNo, I\'m looking to make the point that the argument that we are biased toward babies is not relevant at all. If we both agree that our inherent bias toward babies isn\'t a philosophical defense of callousness or disregard for other kinds of people, then your entire point is irrelevant - it doesn\'t matter that we have some kind of evolutionary psychological hangup around babies, because we both agree we shouldn\'t let that influence our philosophical position on how people should be treated.\n\nTherefore, the fact that robots don\'t magically trigger our psychological desire to protect babies isn\'t relevant philosophically.\n\n>Another ridiculous outlandish take that common sense should already be able to answer , humans by ""design"" are empathic to many non-human things the huge difference is the level of the reaction.\n\nYes, but you\'ve already called my observation above that different humans elicit different levels of response ""extreme"" to the point that I\'m just looking to argue, not discuss. So you clearly don\'t believe that the level of inherent empathy is the answer. Robots may have less inherent empathy than old people, who have less inherent empathy than babies, but **you** just got mad about me pointing out that old people are less empathetic than babies, so, point made.\n\n>You watch a car get tossed into a compacter and crushed into a cube your brain goes meh unless you had some sort of sentimental connection to said car it wont trigger an emotional response.\n\nIf the car started screaming ""NO PLEASE DON\'T KILL ME I DON\'T WANT TO DIE REMEMBER THAT TIME WE DROVE ALONG THE OCEAN AND YOU SANG ALL YOUR FAVORITE SONGS WITH ME"", people would probably start caring really fast though? Like again, we\'re not talking about unthinking, unfeeling machines, we\'re talking about a robot that\'s capable of having emotions, communicating emotions, and clearly making its wishes known.\n\nPeople anthropomorphize shit all the time, to the point where it\'s a common word that you probably don\'t even need defined - and often the stuff they anthropomorphize are things that can\'t communicate or even move.\n\n>A significantly advanced computer system could be trained to have conversations, pose questions, ponder things ect ect and still be simply going through a complex set of algorithms.\n\nThere are schools of philosophical thought that argue all humans are just doing exactly that - responding to inputs with predictable, determined outputs, infinitely into a predetermined future. Are humans no longer people if you take that view of philosophy?\n\n>The question of what humans believe is sentient isn\'t as black and white as you seem to think it is.\n\nAbsolutely, yes, which is why it\'s worth **arguing** that humans should be open to more expansive definitions of sentience, because otherwise we are going to mistreat the first sentient AIs we create because we will be operating from the position that they are non-sentient by default until they prove otherwise, which will by definition require us to mistreat sentient AIs until they are sufficiently advanced to be able to prove they are sentient.\n\nWe don\'t treat babies like clams until they\'re old enough to tell us they\'re not a clam, and that\'s for good reason. We do some pretty awful shit to clams, because they\'re **not people**. If our default state of engaging with things that we are trying to make sentient is to assume we have failed then eventually we are going to succeed and treat the result terribly.', ""Well I wasn't saying anything to contrast the point in the circumstances, I was just talking about how the example in the vote they had put forward that the robots were sentient so we were to just assume they were for the purpose of picking our moral choice.\n\nI'm not really sure I follow with the rest of your things. Certainly I've heard of the claim that consciousness/mind is the primary substance of reality. I don't think I've ever seen any absolute proof of it as you're suggesting, though."", '""Conception"" in this case being the moment where a human baby stops being a fetus and starts being a human baby, then yes?\n\nAt some point you plug your baby robot in, and it turns on for the first time, and it stops being a pile of machinery that isn\'t a person, and starts being a living robot that is a person, yes?\n\nWe all agree abortion is okay but shooting five minute old babies is wrong, even though in practice five minute old babies aren\'t very good at being people yet, and haven\'t been being people for a very long time, and honestly we\'re not really losing much societally in terms of investment if we shoot a five minute old baby. Right? There\'s something more there than just the ""value"" that the baby has already accumulated through its efforts. There\'s some amount of future value being considered.\n\nThere\'s no reason not to extend the exact same future valuation to any other sentient creature that isn\'t a human baby. A baby robot person might not have DONE much yet, but they have all the promise and capability and future potential that a human baby does, so why wouldn\'t we give them the same courtesy valuation and say ""hey even though this robot we just plugged in hasn\'t done much person-ing yet, they have a LOT of person-ing left to do, so it\'s important that we recognize that value when we measure how important protecting them is!""']"
"[""> Our religious accounts of the afterlife *have only been exchanged with ideas more fitting for a secular age.*\n\nHegel secularized gnosticism. You may familiar gnosticism as the framework that all humans are equal to God, only we have been trapped by a demiurge creator in a fallen state. This world is a prison that we're trapped and oppressed in. But you can have secret knowledge, by becoming aware of this secret knowledge that we're trapped it's possible to find rituals that will help to break us free of that prison. Usually by destroying whatever it is that is pointed at to represent that oppressor. Then after breaking free man can ascend to their rightful place as equal to God as it always should have been.\n\nThe last 100 years or so the story narrative of our modern times is the interplay with gnosticism (and closely related hermetic) and politics.Voegelin wrote about this in the 1930s in [Modernity Without Restraint: The Political Religions, The New Science of Politics, and Science, Politics, and Gnosticism](https://www.amazon.com/Modernity-Without-Restraint-Political-Gnosticism/dp/082621245X/)\n\nMarx was one form of this. In his economic based model of gnosticism, the bourgeoisie were the demiurge oppressor. And by adopting the right critical consciousness that the people (everyone else) were imprisoned by them into a fallen and sunken state, that they never asked for, then they could break free and ascend as New Man.\n\nHitler played another form of this. In his form of gnosticism the Jewish bankers were oppressors who had imprisoned the German people in a fallen and poverty stricken state post-Weimar. That by breaking free of that demiurge Germany could be reborn ascendant in an age of New Man where everything would be butterflies and rainbows. Or something.\n\nMao's China did the same thing. Getting rid of the old traditions to rebirth as a new people where magically everything would be perfect.\n\nOur recent flavors are kin to Marx but swapping the economic dimension with a racial identity dimension. And critical consciousness is more or less become racist to somehow magic and butterflies into creation an ascendant New Man.\n\nThese all play off of some form of alienating a segment of society. Building resentment by telling them they're a victim. Denying mental frameworks of success strategies that might improve their circumstances, because to create a revolutionary fervor those willing to sacrifice themselves must be sufficiently tormented as to be willing to throw their lives away to achieve it. They turn into cults. Gnostic cults. This is what a gnostic cult is. The same tactics you see from your local Scientology chapter offering free stress tests to filter the population for those who might hold feelings of alienation and could be subject to indoctrination. The same as that, but instead of stress tests the local Safe Space provides the same strategy to filter those vulnerable to joining the cult.\n\nThe tech industry has flavors of similar breaking free from imprisonment and living in a new era of New Man ascendant. The narcissistic grandeurs often come paired with discussion of oh what are we going to do with the unnecessary people. Clearly we can't have so many humans when the robots and abundant energy are here to handle all of our needs. How can we UBI away the people we don't need who we don't need to employ anymore? These turn dark and genocidal real quick. Hinging on arguments akin to thinkers at the dark of the industrial age who believed we did not need any humans anymore because the assembly line and the car had automated everything. Work changes. Needs change. The theories on breaking free suffer from the Ivory Tower problem. The beautiful systems on paper break down and don't work as designed when put into practice. It turns out nature is messy. Full of probabilities, not models. If the Ivory Tower were skilled at this they would be engineers, that seems to be the only profession able to actually build in a useful way with the tools provided by nature.""]"
"['My car tries desperately to maintain a model in real time of the world, and then navigate safely through that world, and fails regularly to do so, relying on my maintenance of my model of the world to recognize its errant behavior and take control before disaster occurs. I think we aren’t so different, my robot car and me, I’m just better at it than the robot is.']"
"[""Sonic also seems spiritual when you consider that Dr. Eggman is trying to turn living beings into robots in order to control them and make them behave in the way that he prefers (*some similarities to transhumanism like you mentioned*), but Sonic and Tails and Knuckles want to protect the power in the crystals (*7 Chaos Emeralds and Master Emerald*) which can turn Sonic into Super Sonic or which can become very destructive when used appropriately with machines like Dr. Eggman's robots or even Metal Sonic.                                 \n\n\nTechnology itself isn't considered to be evil. Tails likes technology and was flying Sonic in some type of plane in order to help Sonic fly to the *Wing Fortress Zone* during *Sky Chase Zone* in Sonic 2. It's also interesting that the music for [Wing Fortress Zone](https://www.youtube.com/watch?v=M-gocswLwsc) sounds like [American March Music](https://www.youtube.com/watch?v=pgdZjvhk_J4). Here's a cover of [Wing Fortress Zone](https://www.youtube.com/watch?v=nNPIStzy7Zo) more in that orchestrated March Music style. In Sonic 1, we see a regular city at night during *Starlight Zone*, then in the next zone (*Scrap Brain Zone*), we see a very unhealthy industrialized zone with polluted skies, completely controlled by Dr. Eggman.                  \n\n\nKnuckles seem to represent native tribes and how they were affected by a greedy capitalists, especially in Sonic 3 & Knuckles. Knuckles is from an island (*Angel Island*). He wants to protect the Master Emerald which is hidden in the Hidden Palace Zone. Dr. Eggman pretends to not be controllinf and greedy at first and tries ro claim that Sonic and Tails are the evil ones (*environmentalists*). Later, Knuckles realizes he was tricked and helps Sonic and Tails to the *Sky Sanctuary Zone*.""]"
"["">(seemingly) full of empathy\n\nWell, I think that's called living a lie, in terms of pretending to yourself that there's someone on the other end who genuinely cares about you.\n\nDid you know that [human to human contact is positive in terms of health](https://www.google.com/search?q=human+contact+good+for+health)? What does that mean? It means that on a basic fundamental biological level, we are not built to be isolated, and talking to a bot. Our bodies crave contact with others, and no advances in technology will change that. \n\nLet's take it full dystopian cyperpunk for a moment. Even if let's say, ultra-realistic sex robots get prescribed to lonely people to cure depression, that might trick our senses and be a nice distraction for a bit, but our biology won't be fooled. It instinctively knows it's interacting with an inanimate object that is totally indifferent to your being on a fundamental level.\n\nSo that's science saying why chatbots can never really be the cure to loneliness. Ultimately they can only make it worse by fooling one part of us that someone cares, while another part feels more and more despairing."", ""Looks are one thing, but we are made up of billions of micro organisms. If you kiss someone, you're literally exchanging those between your mouths. A sex robot might look real, but it's lifeless, so there will be none of that exchange going on, and your body knows it. And how can it produce pheromones that excite us? There is no chemistry going on inside, it's purely running off electricity.\n\nYou clearly haven't thought this through or know very little about human biology. There is so much going on with human biology that you've completely ignored for the sake of your own argument. Our body instinctively knows that what we are interacting with is lifeless. There will never be a perfect sex robot because you might be able to trick your mind and your vision, but you cannot fool all the rest of your instinctual senses.""]"
