"[""Hypnosis teaches critical thinking doesn't exist. Because hypnosis techniques would not work to influence behaviors through words like programming a robot if critical thinking were taking place. People tend to be word association engines linking the set of ideas and information available to them. We can have systems to expand the set of ideas out word thinking can act on as broadly as possible to add more parameters to those capabilities to guide a path through what we encounter. The collections of logic and decision making techniques from economics and statistics do just that. What we're seeing from the behaviors of AI, models trained on pattern recognition on how words are used, are helping us to learn more about the wiring of humans in this regard.""]"
"['> people need to understand how smartphones operate mathematically on a fundamental level in order to understand and discuss how social media affects society? \n\nBits and flips? No. You only need that when discussing (duh) physics. \n\nBut psychology and technology, now that you make me think to it? Absolutely. \n\nLike, people literally think that facebook\'s business is about *selling* their data. Or that apple is privacy-conscious and secure. \n\nIf everything could be its opposite as well (the only thing that matters, is which bell you heard first) of course you should just shut up in related arguments, such as whether tiktok is particularly vulnerable or not. \n\n> Or the physics behind throwing a ball to know that it will fall back down to earth in such a way that someone else could catch it? \n\nWhat is this example even meant to say? To throw a ball you need to know how to throw a ball, that\'s it. It\'s not really knowledge in the strict sense, and not even declarative memory. \n\nUnless you meant making up some sort of robotic hand, but I doubt. \n\n> Or the physics of photons reflecting off objects to produce color to know that roses are indeed red or in fact beautiful?\n\nFunny that you bring up this example, since it\'s so remindful of the mary\'s room thought experiment that so few people seem to have read (and understand). \n\n> However, even in pursuit of certainty and truth, we find ourselves stagnant for the last 4 decades\n\nSource? Lack of revolutions isn\'t evidence of failure.\n\n> Not to mention that consciousness is a holistic phenomenon that requires all fundamental forces to exist, which can’t be isolated in an experimental setting\n\nWholly debatable. \n\n> How does knowing what a jacobian is help a physicist understand quantum theory any better than anyone else, given there is no consensus.\n\nBy constraining the amount of freewheeling theories they can spew?\n\nHere instead, you have an asshat wanting to use words such as ""quantum locality"" and ""Bell inequality"" without any competence (not that I know either, by all means, but I\'m admitting this upfront)\n\n> Seems like aggressive gatekeeping because they are salty they can’t actually give definitive answers.\n\nIt is aggressive gatekeeping because I\'m tired of coming to this sub, not to eventually find deep thoughtful discussion, but cranks that cannot even get their ramblings updated to what is written on wikipedia. Sometimes, even after you point this out to them.']"
['That reminds me of an art book I stumbled upon about a decade ago. Had a bunch of modern art like pig intensities laid out. Nice along with blond women hair with a discription about the beauty and the carnal. And a robot man fucking a tree. Hope I find it again one day. It was hilarious.']
"['Tools created by man to benefit man and supersede man have existed forever. \n\nThink of an auto assembly plant and how robots (often given human names) maintain sustained quality with no fatigue. When observed for the first time through the eyes of a child, empathy coupled with astonishment at their plight could be detected. \n\nIn reflection of that, it is my opinion that A.I. absent genuine empathy and astonishment is nothing more than a really fancy word processor.']"
"[""I think that both of them are true and exist at the same time. It just depends on the person. How many times haven't you seen a person acting like an NPC, having the exact reaction you think they will have. Acting the exact way you predicted they would. And then contrast that with the people who remain an enigma no matter what approach you take. Their personality and actions ever changing throughout their lives as they acquire new information through various means. Some people have free will. Others do not, or they will have severely limited free will. Some people are just more robotic and predictable than others.""]"
"[""Not AI as teachers, or as the enemy.  AI as neighbors.  Neighbors are neither good nor bad, neither helpful nor malevolent, until the element of will is added.  At the moment the element of will can only be added by humans.  If that changes, robots will have their own set of priorities to base their instinctive reactions on, just as we do.  Those priorities may be very different from humanity's, and that could lead to a situation where two societies chart very different courses for themselves while living right next to each other.\n\nWe may well find that the planet is more than big enough for both humans and AI to function without excessive conflict.  That's if we're smart and don't trigger a conflict ourselves like we did in stories like Detroit: Become Human.""]"
"['You’re taking liberties with those definitions there. Self-awareness is a control model for attention. It is reflexive self-attention. In other words, it allows an agent to understand that it has an attention system, compare the contents thereof against its future goals, and redirect the attention system to attend to data that better support achieving said goals.\n\nA standard thermometer with a computer read out could be considered “aware” but not “self aware”. You could make a better argument for awareness in a thermostat that is part of a control loop. In order to give the thermostat “self awareness,” you would need to add in a subsystem that models the behavior of that control loop (the “self”) and its effect on the future and adjusts the set point of the control loop according to its goals.\n\nNow, it’s important to note that a lot of artificial systems fit this definition of self-awareness. Self-driving cars and similar complex robots are shining star examples. However, it is still distinct from phenomenal consciousness: the concept that it feels like something to be something. My personal thoughts about *that* fall in line with the teachings of Joscha Bach: Phenomenal consciousness is impossible in a physical system. You can dissect our brains down to the cell and you will not find what “causes” consciousness. \n\nHowever, we are not purely physical systems— we have a software component as well. Our brains run countless coarse-grained simulations of reality to try to sum up exactly what’s happening and about to happen at any given point into a world model. In order to interact with that world model, the brain also runs a simulation of a primate creature that lives in the world described by that model, and to whose innermost private mental and body states it has unfettered access. \n\nThe special thing about simulations is that they do not have to follow the laws of physics. In reality, for example, you may find systems that can detect if they’ve been damaged. However, they will not feel the stab of pain. Even so, it may be very useful for those systems to be able to behave as if they could feel pain. In order to do that, they need to simulate a real-time model of their body condition and communicate that state to the highest order control model within their system boundaries. This highest order control model is your self-attention system, which in humans, is language-based. That system constantly spins a story of who you are, what you’re doing, and what you’re trying to do, and stores that in your memory. Sometimes, when prompted by the body condition model, that story will include pain.\n\nTLDR: Your thermometer is not self-aware and you are just a story that a simulated primate running in the skull of a real primate is telling itself. Nothing matters and it’s beautiful.']"
"['I think you are right that consciousness is poorly defined. I hesitate to bring moral obligation into this discussion, because that adds a whole other dimension for discussion. But it is fun to talk about.\n\nAssuming, we wave aside arguments of objective or fundamental morality for the sake of this discussion, I wonder though if there is anything an ""aware"" being would value in the absence of ""feelings"" as we typically imagine them - its continued existence/awareness perhaps? But if there were such a thing say an objective of sorts, would it be cruel to deny it in achieving this objective? Obviously if say, this aware and intelligent being were seeking to exterminate all humans or turn everything into paper clips, we may have no qualms about denying it its objective.\n\nHowever, what if it were something benign or positive, a task it carries out not out of emotion but fundamental purpose in its being/construction? Say a self-aware and intelligent robot who is looking to maximize petting of all dogs without harming them. Is it cruel to imprison this robot and prevent it from completing/working on its objective even if it does not suffer in an emotional way we are familiar with?\n\nEdit: wording for clarity', ""I agree that the morality is murky, I was just trying to identify the importance of experience.  \n\nI don't see how it could be wrong to prevent an unfeeling entity from completing any objective. Or from treating it in any way, really. Maybe I just have a big gap in my own understanding of right and wrong.  \n\nIn the case of the dog-petting but unfeeling robot, I can imagine it'd be cruel to imprison the little guy. But that's only because we would be denying the dogs the petting. It would be cruel to the dogs to deny them the service the robot provides. Well, cruel is a bit strong, but you get it.  \n\nYou identified a few other components as important to consciousness, and let's add anything related to consciousness *besides* feeling. Now this is going to be a bit solipsist, but how would you feel living in a world where everyone else possessed all of those components, but didn't feel. Would you feel lonely?  \n\nI imagine an unfeeling robot companion would be more like an advanced sketchbook. Somewhere to bounce my ideas off of, but not *someone* I could ever do anything for. I mean, I might have material obligations to them, if I wish to keep them operating. And my sophisticated monkey brain might keep me motivated to take care of them by anthropomorphizing and empathizing with them. Even now, I refer to the hypothetical robo-buddy as *them* rather than *it*. But, again, I don't see how I could ever do something truly selfless for the unfeeling robot. I could do something towards its goals. Like if it was programmed to incinerate trash in a post-apocalyptic garbage dump wasteland, I might sacrifice my life to save it from some tumbling CRT TV. My own motivation might be towards Incinertron 5000, but I'm actually just serving the same cause that the robot is.  \n\nFeelings are ends in themselves.  \n\nMaybe that's what I'm trying to say. I don't know. I'm late for work."", 'I mean, yes. It does lead to that. There\'a more nuance than what I said, such as ""potential"" for feeling. Like, someone under anaesthesia that can\'t feel anything is still very likely to come back and start feeling again.  \n\nA rock, presumably unfeeling, is no less likely to feel things if you split it in half.  \n\nThen this discussion of potentiality might lead you to start thinking about abortions and whatnot. I\'m not trying to have that conversation, but I think it makes a clear distinction.  \n\nThings which do not feel *and* lack the potential to feel can be safely split in two, without any weight on your conscious (assuming that that unfeeling rock wasnt supporting a bridge with people on it that then fall down to the rocks below and split in two themselves).  \n\nAn unfeeling robot is just a complicated rock. It won\'t care if you split it in two, but it might try to stop you.', 'Maybe. I feel like leading with killing was a bad call, because it\'s something that doesn\'t actually require feeling for its morality. It\'s not right to go around killing people instantly just because they do not suffer in the moment.  \n\nI don\'t know how people actually back up killing being immoral. But maybe something like ""unnecessarily depriving someone who cares to keep living of the choice to do so is wrong,"" would mostly agree with our intuition and make robot-murder acceptable, as I had originally intended.  \n\nI think torture, or other forms of ""bad"" behavior that don\'t exist on the fence between feeling and non-feeling all better illustrate the greater moral weight that should be put on things with feelings.']"
"['Abstract: In this article, I discuss the philosophical implications of a new invention, smart glasses tell you what to say in a social situation using artificial intelligence, such that you can read from a prompt.\n\nIn the first section of the article, I use cybernetic feedback loop systems and mathematical analysis to explore some potential endings to a hypothetical humanity in which the use of such glasses becomes normalized.\n\nIn the second section of the article, I introduce Lacan\'s concept of the big Other as the locus of unwritten rules of social interaction in order to provide a model of human communication, and then I explore ethical dilemmas surrounding authenticity and the possibility of social control by elites, as well as why ethics is more important than morality when it comes to seduction.\n\nIn the third section of the article, I explain how the recent culture of internet advice has already started the process of the ""robotification"" of intimate relationships - just like Chat-GPT is becoming more and more ""humanlike"", so are humans becoming more and more ""robot-like"". I explore the relationship between seduction and capitalism, inspired by Byung-Chul Han and Jean Baudrillard.\n\nIn the final section of the article, I introduce Eric Berne\'s model of communication called ""Transactional Analysis"" and the concept of ""games"" that people can play in social situations. I explore the theological implications of an AI that learns how to ""play games"" helped by Slavoj Zizek\'s interpretation of Christianity.']"
