"Robotics and Automation cooperative in Developing countries, owning/developing and researching Robotics for local needs, empowering communitiesHello all, 

I've been thinking of an idea of starting Robotics cooperative for Developing countries, particularly since I'm from India, I'd like to propose a cooperative for countries like India, where there's abject poverty and Robotic solutions can used for unique problems, one example is socio-political in nature, which is Manhole cleaners dying inside it because of lack of proper standards gear involved in diving in sewage water,  the people who do these jobs are from a certain caste, and no one else would take up this kind of a job, and unless Indians change their attitude and take up jobs outside their class, and also improved standards which involve wearing oxygen tank and hazmat suit etc. News coverage of one such robot invented by Engineers in Kerala(A southern State in India): [https://www.indiatimes.com/technology/news/swachh-bharat-day-genrobotics-breakthrough-manhole-cleaning-robot-to-be-felicitated-by-govt-353999.html](https://www.indiatimes.com/technology/news/swachh-bharat-day-genrobotics-breakthrough-manhole-cleaning-robot-to-be-felicitated-by-govt-353999.html)

Other ideas include marine robots for cultivation of sea weed, fish farm, etc, as India has a big coast line, and communities which involves fishermen and need for modern solutions to compete against other countries, and big corporations. 

And much more, like Agriculture robots, Automated Covid test facilities etc.

My plan would to be leasing robot, RaaS, by procuring robots, and using the profits developed from these services to do R&D for local needs and making low cost solutions. 

I'm naming it a cooperative because the Robots being leased could be owned by a particular community, and also some help from us(we would be part of fractional ownership).  

I'm looking for enthusiasts, cheer leaders, beginners, engineers, professors, researchers, finance professionals, economists etc to take part in this initiative. I've been having this idea for a while, so please message me(or comment here so I can DM you) and we will get on a Discord to brainstorm ideas about funding possibilities to kickstart this initiative, and if we should be a for-profit or non-profit company(I don't want to see profit as a taboo word, if there's money to be made, it should not be a thing of shame or guilt), and other things. 

About me: I'm a Master student in Robotics in Germany. I'm interested in intersection of social causes and robotics for good."
The SlaughterHouse Mark II shreds an Xbox 360
"Vote for Pakistani Team's Poster for the ISSSP CompetitionAssalamualaikum everyone,

We need your support to excel in the International Space Science and Scientific Payload Competition (ISSSP), hosted by China with regards to payload design for Tiangong space station. Alhamdulillah! We competed with all the teams across the world and were able to qualify to the final along with 14 other international teams. Saf-Shikan is working on the design of prototype for a crawler robot capable of traversing the exterior of Chinese Space Station. Currently the voting for the best scientific poster is live at [https://www.wenjuan.com/s/ZZ3Uvad/?continue\_view=1](https://www.wenjuan.com/s/ZZ3Uvad/?continue_view=1). We need your support in order to excel in this module of the competition. Our team, Saf-Shikan, is listed under the section ""Innovative design of space science loads (Theme 2 - College student groups)\*"". In other sections (Theme 1 and middle school), you may vote any team and then submit your vote accordingly. \*Please click submit after scrolling down to the bottom. Otherwise, the vote won't be submitted. Your vote can help us showcase our skills and represent our country.

Thank you for your support.

Best regards."
"What sort of materials could a high school robotics team useI recently started dating this girl and her son is on the high school robotics team and is really into it, Iike possibly on an aspergers level. I really like her and want to make an impression. 

I work in IT for a large corporation, and we have a warehouse full of old computer/equipment parts going in the trash or headed to recycling. 

What are some pieces/components/materials that I could donate? Stuff that they always seem to be out of or use more of."
I just built my first combat robot
Video of our ring-shooting turret robot that competed in the Ultimate Goal First Tech Challenge Competition
"Reddit, Let's Compete in the NASA Space Robotics Competition!Hey everyone! Head over to https://www.reddit.com/r/obotics/ to check out the official team subreddit.

rLoop (a Reddit formed team that competed in the SpaceX Hyperloop Pod Competition) is doing extremely well, even when overcoming hardware logistics problems that arise from having a team spread across the globe. Since the NASA Space Robotics Competition is all in simulation, we can have a huge team coding 24/7 with no hang ups. This will give us a huge advantage. Leave a comment or message me if you're interested. I'll put together a slack soon.

Send me you're email in a message so I can add you on slack if you're interested.

This will be a super fun project and will look amazing on your resume.

Here's a link to the competition details if you're interested:

http://spectrum.ieee.org/automaton/robotics/space-robots/nasa-space-robotics-challenge-tasks-prizes-how-to-participate

EDIT: For those of your who were asking: 
I've emailed one of the organizers and there isn't a team size limit. We're good to go :D"
Had my middle schoolers build a collision-avoidance robot with Lego EV3's in the robotics elective. They competed to see which bot would be the last one standing without running into another bot or falling off the table.
"Becoming a Jack of All Trades EngineerIt was always my intention to use the mechanical engineering field as my foundation to get into the door of robotics. I always thought that I wanted to be exceptional at one thing and one thing alone, however, as time has passed, I've only realized the opposite.

With the engineering teams I've had the pleasure to work with for research, its the people that can wear multiple hats that always turn out to be more valuable to a team, while they also have their one main specialty that gives them their edge, instead of being a one trick pony. Now when I say this, in no way am I devaluing the need for those who are masters in one field, we need those types, this is just what i've seen personally.

I used to only want to focus on mechanical engineering topics and neglect the computer, network, and electrical side of products all together. When it came time to conduct research on campus, this mindset had me sitting on the sidelines during competitions watching others troubleshoot problems that I had no idea how to contribute properly, and it pissed me off.

On top of that, I just recently finished my 10wk internship this summer, and the environment there only proved what I observed during my on campus research competitions to be true, on a much larger scale. The people at this site all could contribute on the mechanical, electrical, software, and networking side of a task, and if they did not already have the skill, they were more than open to have someone who was an expert there teach them what was necessary. Being able to observe that was amazing because everyone could contribute at any point in time and just pick up where the other left off with at the very least a decent level of competency. Collaboration was smooth and communication even smoother. That's when I realized that I had it all wrong.

I want to set aside time each day (4hrs max) to polish the specialty I want (mechanical design), while learning the basics of electronics, software development, and network engineering. Im calling it my JOAT Training (Jack of All Trades Training) lol.

***My question is about my approach...***

* ***should I spend an hour each for mechanical design, electronics, software dev, and network eng all separate from each other***
* ***or is there a different method you can see that will encompass all of the four topics previously mentioned in one session***  

   * ***I was thinking like if there was a site that had a list of previously built engineering product blueprints online and just breaking them down on the mechanical, software, network, and electrical levels***  

      * ***with the goal that I would understand how each field ties in with the other on a ""systems engineering"" level through breaking down their components***

***TLDR - What is the best approach to train to become a Jack of All Trades Engineer? (Mechanical Design, Electrical Engineering, Software Dev, Network Eng)***"
Tiny robots will compete against DARPA’s “robot Olympics”
"Hi. We are currently competing in the RoboCup German Open Competetion. Ask us anything!Hello. We are [Nao-Team HTWK](http://robocup.imn.htwk-leipzig.de/). We are 14 humans and 18 robots and at the moment we do compete in the [RoboCup German Open](http://www.robocupgermanopen.de/). We are playing [Robot-Soccer/Football with bipedal robots](http://www.robocup2015.org/).

You can watch the event [live](http://streamteam.fbm.htwk-leipzig.de/), check the [schedule and results](http://www.informatik.uni-bremen.de/spl/bin/view/Website/GermanOpenResults2015) (CEST times) or view our [recordings](https://www.youtube.com/user/naoteamhtwk/featured) afterwards.

Feel free to ask us questions about the event. We are reguar attendees of the German Open, the Iranian Open and the World Championship. We also provide some very experienced referees and RoboCup event organizers so you can as some questions regarding these topics as well."
"A take I haven't seen on ""Why the emphasis on humanoid robots over purpose built bots?""Wrote an effortpost response to a question I've seen multiple times in many forms. Also serves as a response to people straightforwardly arguing against the concept of a humanoid robot being practical ([https://www.youtube.com/watch?v=Wk1oClYJE58](https://www.youtube.com/watch?v=Wk1oClYJE58)). Posting it here as its own post because I'd love to hear other people's opinion.

TL;DR for long post: We do engineer simpler purpose built ones and will continue to, but there is a big conceptual reason to focus discussion on humanoid robots (it's a legible and essentially inarguable milestone), and a huge practical and economic advantage in actually developing such bots (learning from human execution of tasks and then replacing them 1:1 allows for extremely rapid deployment at massive scale).

For one, there already exist and will continue to exist a huge number of non-humanoid robot form factors that are designed with specific use cases in mind. No sensible developer thinks that a factory of humanoid robots will replace industrial manufacturing robots or that it's better to have a humanoid robot try to crawl through pipes in a collapsed building when a smaller exploratory bot would do better.

That said, every time (counted in the dozens) I've seen people try to advance the position of  ""humanoid robots are a silly sci-fi preoccupation"" and then have people respond to it, I've never seen the two responses that I think are the strongest. First, it's just a very legible milestone. Humans are meat puppets, and society as it exists is built on humans doing labor. For the physical element of that labor in many areas, automation and robotics have replaced human work by being more productive for less cost in significant amounts. But this replacement is far from total; billions of peoples' livelihood still comes in large part from the physical labor they perform. When we actually achieve a human-equivalent robotic form factor (simple visual: the robots as depicted in the Will Smith I Robot movie), it will represent a comprehensible milestone on what is actually a gradual shift in replacing human labor with cheaper and more efficient robotic labor. Millions, if not billions, of human jobs will have been replaced prior to the day that robot is released, and it will be some amount of time before production of robots will scale to the point that all physical labor jobs will be replaced. But once that human-equivalent robot is realized, at whatever cost, it's essentially proof that human labor is obsolete. Those bots will get cheaper, and faster, and stronger, and more capable in ways that humans will never be able to compete with.

The second point I have never seen is that humanoid robots have a massive advantage over custom designed bots (in many use cases) that goes far beyond the usual (strong and valid) argument of ""we live in a world designed for humans and bipedal, human-sized robots can navigate it better."" That advantage is training data. Development of robots is difficult and expensive, but it's often the programming of their movements/tasks that becomes the most complicated element of deploying them as useful labor. Think all the videos of industrial robot arms failing to make a hamburger or latte. 

Now imagine McDonalds or Starbucks installing cameras in a number of their locations to capture how their existing human employees perform their jobs (with or without mocap dots on their uniforms, depending on how computer vision advances over the next few years). Plugging that motion data into machine learning models would then be able to directly provide task-specific programming to a humanoid bot. Once we have a human-equivalent bot it becomes a platform for multi-purpose use. Every human doing a job, from construction worker to organic farmer to vehicle repair to in-home nurse flipping their patient to soldier, becomes training data to teach that bot how to replace them. Intelligent humans with economic incentive, and a history of predecessors to learn from who also had creativity and incentive, are likely to have developed and converged on efficient ways to accomplish most tasks. Someone who's spent years flipping burgers or laying bricks is way more likely to have developed the optimal technique than an engineer trying to design movements with no actual experience. A training set built from thousands of experienced people is even more likely to find optimal execution. The more repetitive the job, the faster and easier a job can be digested by ML, but with enough data and compute, everything is theoretically on the chopping block.

Think of the cost savings of being able to replace every human being working in a designed-to-be-staffed-by-humans workplace with a mass-manufactured bot, rather than having to design and rebuild every restaurant, mechanic shop, dentist office, etc etc etc. And once a job is trained, analyzed and ""solved,"" then every single bot can perform that job. No more training replacement employees or new ones at a new location. And for edge case AI failures, a human ""pilot"" could take over remotely using VR/mocap. Their human solution to the failure would then become part of the training set to avoid that failure ever again.

Yes, a top down burger joint designed to be run by custom bots could probably achieve some theoretical efficiency gains. But would those gains justify the cost to develop and rebuild every McDs, or is it sufficient to just slot bots into existing locations? Whoever develops the human-equivalent robotic platform that can even do 85% of what a human can do (let alone the eventual 99% or 105% or 300% productivity that mechanical humanoids will likely achieve over meat puppets) could be the most profitable ""single product"" ever launched. If it comes to market sufficiently developed, with a sizable enough lead on competition, etc, it could become the fastest consolidation of power (economic and otherwise) in history. A lot of ifs/coulds, but enough huge potential gains that it makes absolute sense to chase.

I wouldn't be super surprised if someone has counterpoints to this, as that might explain why I haven't seen this angle expressed before. I've paid attention to this subject for a long time, read books and probably hundreds of articles on robotics, the economics of automation and the nature of labor, and this frame has been absent from all of them. I am quite sure I'm not the only one to think of it this way, so I am eager to see if others have encountered the ""humans as training data"" perspective."
"Sports Field Line Marking RobotI'm trying to design and build a Line Marking Robot for various outdoor sports fields. I'm new to robotics, but I have friends who aren't, and as long as I come to them with small problems, I'm confident they'd lend me their time. This project is for fun, but if the result is awesome, I'd certainly offer it to my local soccer club, rec programs, and high school. The advantages of automating this job are great, but the commercial products are extremely pricey.

I figured I could write a program and use IMUs and maybe some wheel encoders to get a decent result. If I were doing tennis courts, I'd probably have given it a go, but the fields I'm painting aren't perfectly consistent and there needs to be a way for the robot to localize and correct.

I've looked into all sorts of beacons, but it seems that RTK GPS is the only system with the sort of accuracy I'd need to be able to paint a straight line 100+ meters long outdoors. I have no problem with RTK GPS except that it seems like overkill, and the end user would need to be fairly competent. There ought to be a cheaper and simpler way to get cm-level accuracy in a flat space that is a maximum of 1 hectare (usually much smaller), but I'm not finding one. IR seems great, but I'm worried about fog. RSSI seems promising, but all the open source projects I've found that use it are pretty rough. Ultrasonic seems really ""noisy"" and variable.

Does anyone have suggestions for other methods and open source projects I could check out?"
My Highschool's robot competing in the FIRST Robotics Competition. 
Hi-res picture of DARPA's Atlas robot that will be competing in two months at the DARPA Robotics Challenge
I made this robot to compete in a quarter scale version of FIRST Steamworks
"Hi. We are currently competing in the RoboCup German Open Competetion. Ask us anything!Hello. We are [Nao-Team HTWK](http://robocup.imn.htwk-leipzig.de/). We are 18 robots and 20 humans and at the moment we do compete in the [RoboCup German Open](https://www.robocupgermanopen.de/). We are playing [Robot-Soccer/Football with bipedal robots](https://www.robocup2017.org/).

There are several subcompetitions at Robocup. We participate in the Standard Platform League (SPL). There are other leagues as well with football/soccer playing robots in several sizes and locomotion types (legs, wheels). There are also rescue robots, logistics competitions and home assistance competitions.

You can check the [schedule and results](http://spl.robocup.org/events/german-open-results-2017/) (CEST times) or view our [recordings](https://www.youtube.com/user/naoteamhtwk/featured) afterwards.

Feel free to ask us questions about the event. We will answer questions here when time allows us. We are reguar attendees of the German Open, the Iranian Open and the World Championship. We also provide some very experienced referees and RoboCup event organizers so you can as some questions regarding these topics as well. The event will run until sunday afternoon and we will be answering questions until then."
"I'm helping to start a robotics club at my university! What robotics competitions could we plausibly compete in without a huge budget?We have some faculty signing onto this endeavor and I want to be able to propose competitions that are more suited to a budding robotics program (I'm a student, btw). Funding is uncertain, but I'm not optimistic about getting decent funding during the economic crunch."
"Installing 3rd Party Library Dependency on a Segway LoomoHey everyone! 

I’m a new robotics developer working on a Segway Loomo, and I’m having some trouble installing the dependency for the following: 

https://github.com/segway-robotics/loomo-algodev

I haven’t been able to find anything as to an updated way of installing the dependency, as it states “The 3rd party library should be downloaded and extracted to dependency\3rdparty_android:”

I don’t see this folder in Android Studio Electric Eel (patch 2), but this repository is rather old and the location may have changed. 

Would anyone know where to install this library, and if it would be installed on the robot, Android Studio, or both?

Thank you!!"
"DIY Electric Wheelbarrow - The InsideHi again everyone! I was asked a few times to show the inside of my really rickety DIY Electric Wheelbarrow, so before I take it all apart and show you how to build a dependable one for my next video, I just wanted to share this one pre-destruction!

I don't like posting YouTube directly on here, but if you would like to see more of my videos please visit my channel -
https://youtube.com/shorts/rK1j9TYvjPQ?feature=share

Thanks everyone for the support!"
"I suppose to install pytorch in Jetson TX2 NX , but facing this issue. Can anybody help me out…its urgent"
"Cross posting from ROA Answers for more visibility : In professional large scale robotics systems, what are the best practices for system design and package dependencies"
This is an underground space with no positioning and no signal. Are drones up to the job?
