"I am thrilled to finally unveil my latest creation - Arctos! This has been my labor of love, and I can't wait for you to experience it. The hosting may be a bit slow at first, but trust me, it's worth the wait. Follow the link https://arctos.rf.gd/ and let's build something amazing together!"
"Amazon bought the company that makes the Roomba. Anti-trust researchers and data privacy experts say it's 'the most dangerous, threatening acquisition in the company's history'"
"12V power wheels battery for my fathers robot (he is not careful with batteries)TL:DR - Is using the power tools adapter (like they use on the kids power wheels cars) a good battery solution for my old man that I am hesitant to trust using a Li Ion pack. If you have a better solution it would be appreciated. 

I will try and keep it short and simple. I have made a robot/ tank for my dad to use to go under houses. I am trying to think of the best, and least likely to start a fire, solution for the battery. For testing this robot I have used a 3S Li Ion that I wired up a while back for a drone. It works great. I have considered sticking that in there, but him having to take the battery out each time and put it on a balance charger and all is a pain and I doubt he would want to do it. Also, a 3S battery pack without a BMS is sketchy, especially when its him that is dealing with it. 

My main theory as of now, is to use those 12v power wheel adapters and use like a Milwaukie battery pack with it. My thinking is I can just stick the adapter on the top of the robot and he can easily remove batteries and charge them, while being safer. In my mind this is the best mix of easy and safe ish. There is already chargers for those batteries that are pretty easy and usually they have some protections built in. Makes me feel much more comfortable that just a 3S li ion pack sitting in the enclosure over time. 

I would really appreciate any opinions here, mainly I am looking to see if anyone thinks this is a bad idea. If you guys think I should maybe go another route. Also, I don't have any experience with these power tool adapters, so I would think if anyone would when it comes to robotics you guys would. 

Thanks so much, I appreciate any feedback."
Would you like this kind of robot? Is it a positive attitude or a negative attitude?
"Where can I get custom closed loop GT2 belts?I have a 3d printed 330mm Ninja Flex closed-loop belt I'm using now. But I'm not certain of its long term durability. There are a couple sites online where I can buy them, but I'm wondering if anyone has a trusted source.

I've also tried glueing an ""endless"" belt based on some online tutorials, but they tore apart right away. I need something reliable."
"Ardupilot dev conferenceThe Ardupilot community had its conference in Canberra last weekend. You can watch the talks on the YouTube channel linked. Some really cool stuff about multirotor controls, state estimation, synchronized aerobatics with fixed-wing, controlling a scale F35 with ardupilot, and much much more.

ArduPilot is a trusted, versatile, and open source autopilot system supporting many vehicle types: multi-copters, traditional helicopters, fixed wing aircraft, boats, submarines, rovers and more. The source code is developed by a large community of professionals and enthusiasts. New developers are always welcome! The best way to start is by joining the Developer Team Forum, which is open to all and chock-full of daily development goodness."
"How to access relative pan/tilt on this UVC webcam?So I bought this pan-tilt-zoom camera: [https://www.amazon.com/OBSBOT-AI-Powered-Omni-Directional-90-Degree-Correction/dp/B08NPGNMV8/ref=sr\_1\_2\_sspa?keywords=obsbot&qid=1678776407&sprefix=obsbot%2Caps%2C142&sr=8-2-spons&ufe=app\_do%3Aamzn1.fos.f5122f16-c3e8-4386-bf32-63e904010ad0&psc=1&spLa=ZW5jcnlwdGVkUXVhbGlmaWVyPUFaMlVOV1BYQU01WkomZW5jcnlwdGVkSWQ9QTAzNjY1MzczVjRTSjVNWEhQVTNCJmVuY3J5cHRlZEFkSWQ9QTA1NzA0OTQzUUgwRkwzU1ZGVVAwJndpZGdldE5hbWU9c3BfYXRmJmFjdGlvbj1jbGlja1JlZGlyZWN0JmRvTm90TG9nQ2xpY2s9dHJ1ZQ==](https://www.amazon.com/OBSBOT-AI-Powered-Omni-Directional-90-Degree-Correction/dp/B08NPGNMV8/ref=sr_1_2_sspa?keywords=obsbot&qid=1678776407&sprefix=obsbot%2Caps%2C142&sr=8-2-spons&ufe=app_do%3Aamzn1.fos.f5122f16-c3e8-4386-bf32-63e904010ad0&psc=1&spLa=ZW5jcnlwdGVkUXVhbGlmaWVyPUFaMlVOV1BYQU01WkomZW5jcnlwdGVkSWQ9QTAzNjY1MzczVjRTSjVNWEhQVTNCJmVuY3J5cHRlZEFkSWQ9QTA1NzA0OTQzUUgwRkwzU1ZGVVAwJndpZGdldE5hbWU9c3BfYXRmJmFjdGlvbj1jbGlja1JlZGlyZWN0JmRvTm90TG9nQ2xpY2s9dHJ1ZQ==)

And I'm trying to control the pan-tilt mechanism from Python. The developers of this camera implemented UVC protocol and I can verify they implemented absolute pan/tilt. However, they did not implement relative pan/tilt, which is what I need.

What are some ways I can have access to relative pan/tilt control? 

I know that they have this functionality available because their proprietary software has this joy-stick control and it's definitely implementing relative pan/tilt (See picture below). .   


By chance, can I somehow reverse engineer this GUI so that I can see what sort of functions this GUI is calling so that I can call it from code? Or can I somehow implement my own UVC protocol on this device? These are some things I'm not sure about. 

&#x200B;

https://preview.redd.it/och8zmndknna1.png?width=551&format=png&auto=webp&v=enabled&s=57194d6e9d7b1463ff7b141358f230cc094bdd15"
Loona RobotI’m interested in getting a personal robot. I was looking at Loona. When will Loona start getting produced? Is this something I can trust to buy?? I don’t want it to be another Digital Dream Labs catastrophe.
"Recommendation of 6 DOF manipulator robot to use with ros at home (student budget)Hello, 

I have been looking for a manipulator since I started my phd just to improve my skills in ROS which I'm using every day. I would like to have it to test some code, as I'm developing a custom control algorithm for a robot. 

Can anyone give me a tip about a nice robot to start? As this robots are quite expensive for my budget right now (like the dobot CR or the myCobot), I would like to invest this money in something that I can trust.

Thanks in advance!"
Would you trust a Robot to OPERATE on you?
Human-Computer Interaction Glow Up: Examining Operational Trust and Intention Towards Mars Autonomous Systems | ASCEND 2021
Tiny Robots Have Successfully Cleared Pneumonia From The Lungs of Mice
NASA Webinar: Technology for Trust in Human Operators
A Purdue Professor Is Looking At Ways To Measure Trust In Real-Time To Design Robots That Can Sense Humans’ Levels Of Trust In Them And Adjust Their Behaviors Accordingly.
"Generic gear motor couplingsI need to use some of the generic DC gear motors below. They have a shaft with what I measure as a 5mm double-d shaft.  I want to get couplings for them...but I can't find anything.  Other than 3d printing everything, when people use these, what do they do?

Motor:

[https://www.amazon.com/Cylewet-Motor-Shaft-Arduino-CYT1037/dp/B01N9MS3UZ/ref=asc\_df\_B01N9MS3UZ/?tag=hyprod-20&linkCode=df0&hvadid=343252307519&hvpos=&hvnetw=g&hvrand=15792488831872382863&hvpone=&hvptwo=&hvqmt=&hvdev=c&hvdvcmdl=&hvlocint=&hvlocphy=9032937&hvtargid=pla-737009264350&psc=1&tag=&ref=&adgrpid=64453690210&hvpone=&hvptwo=&hvadid=343252307519&hvpos=&hvnetw=g&hvrand=15792488831872382863&hvqmt=&hvdev=c&hvdvcmdl=&hvlocint=&hvlocphy=9032937&hvtargid=pla-737009264350](https://www.amazon.com/Cylewet-Motor-Shaft-Arduino-CYT1037/dp/B01N9MS3UZ/ref=asc_df_B01N9MS3UZ/?tag=hyprod-20&linkCode=df0&hvadid=343252307519&hvpos=&hvnetw=g&hvrand=15792488831872382863&hvpone=&hvptwo=&hvqmt=&hvdev=c&hvdvcmdl=&hvlocint=&hvlocphy=9032937&hvtargid=pla-737009264350&psc=1&tag=&ref=&adgrpid=64453690210&hvpone=&hvptwo=&hvadid=343252307519&hvpos=&hvnetw=g&hvrand=15792488831872382863&hvqmt=&hvdev=c&hvdvcmdl=&hvlocint=&hvlocphy=9032937&hvtargid=pla-737009264350)"
"RT/ Future autonomous machines may build trust through emotion. Robotics biweekly vol.13, 10th September — 24th September"
humans are now heading towards building trust on Robots
"Would anyone really trust a robot chef or automated carespecially the car, i'd probably be super nervous

[https://www.youtube.com/watch?v=opnJVN-f2cE](https://www.youtube.com/watch?v=opnJVN-f2cE)"
"What do you need to trust fully autonomous robots?Autonomous systems promise to facilitate the way humans make decisions in our personal lives, business, enterprise, and even the military. These systems use sensors, data, and machine learning to minimize the cognitive process required by operators to make critical decisions. The continuous monitoring and processing of any structured data created by our surroundings can speed up tasks that used to take hours, days, or even months. But can we really trust their way of thinking? Can we place our lives at the hands of these machines?

Machines have been able to take on mechanical tasks more efficiently than humans ever could. They quickly proved they were more efficient than us and we got used to the idea of letting them take over the simple mundane jobs we don’t necessarily want. But machines are evolving quickly; faster than many of us anticipated. They are intertwining with our lives more each day, and the level of cognitive power is challenging our own. The amount of trust we must place in these machines is increasing every day, and the consequences of their mistakes may be deadly in some cases. Placing our trust in these machines becomes a continuous game of risk management. Do I trust this machine enough to make an actionable decision that might impact my life? Can I trust this machine has considered all scenarios better than I could with the given parameters? Has anything or anyone influenced their programming to purposely influence my thoughts or actions? Has this machine been tested enough to cover all possible use cases applicable to my needs? What does it mean for a human to trust a machine? How much trust is enough?

I don’t think we’ll find a single answer that satisfies everyone; since the very definition of trust might be different for each one of us, so let’s start with the same basis. Merriam-Webster’s dictionary defines trust as:
    
     Assured reliance on the character, ability, strength, or truth of someone or something.

So, it seems we must rely on machines to be a part of our decision making process, and we must have some degree of confidence in the ability of that machine to shape our reasoning towards some belief or action.

Now, let’s break down the composition of these autonomous systems. We can classify them into two categories: Autonomy in Motion and Autonomy at Rest. This is a simple distinction between systems with kinetic functions such as cars, drones, or robots and systems with non-kinetic functions that operate virtually in software such as personal assistants, cyber security systems, etc. These systems rely on algorithms to analyze large amounts of data generated by connected components such as radar, cameras, network traffic, Global Positioning Systems (GPS), Electromagnetic Sensing (EMS), etc. All the data is put together in a place where the system can make sense of it and then use machine learning, artificial intelligence, data modeling, and scenario generation, among others algorithms to analyze that data and provide recommendations to operators. The operators then must trust the autonomous systems and make decisions based on their analysis. Each decision brings a risk associated with it and that risk drives the way we build the redundancy of these systems. Critical autonomous applications require a higher level of confidence, so these systems might leverage multiple input sources and fail safes to be able to provide reliable functions. We need less trust in a personal assistant that turns a light on in our house than an autonomous car that drives our family around, since our risk assessment of both functions is vastly different. We think harder before we put our kids in an autonomous car than we do before asking Siri to recommend a song, since the failure of one system doesn’t have the same consequences as the other.

There are three main fields where autonomous system developers can improve to provide trust between the human and the machine:

1. Human-Computer Interaction (HCI): Engineers have realized that they cannot lock themselves in a room to build products; the integration of engineering and human sciences is necessary to build comprehensive solutions that meet the user’s needs. This is becoming more and more obvious as the complexity of these systems increases. Humans need to understand why decisions are made without having to know implementation details. This is indispensable in critical applications where human lives are at risk. The handoff between the human and the computer must be seamless in the decision process to work.

2. Cyber Security Systems: Input components may lie outside the boundaries of the physical system. Distributed computing systems leverage the computational power of the cloud infrastructure to perform analytics of large amounts of data. The data must be validated against a valid predefined set in order to be classified depending on the system needs. Autonomous systems still have the same cyber security needs as other components—malware detection, Intrusion Detection Systems (IDS), Intrusion Protection Systems (IPS), Deception Technologies, etc. These types of systems still need to be in place, although two differentiations can be made:

a. Cyber security systems need to become smarter by using technologies such as machine learning and Artificial Intelligence (AI) to augment their capabilities in order to keep up with the different forms of attacks their adversaries bring. Techniques such as signature base detection are quickly becoming obsolete thanks to polymorphic attacks that can mutate based on their targets. Systems have to change from being reactive to actively predicting threats, and from being static to dynamic.

b. Autonomous sensors bring new challenges to the cyber security space. Machine learning algorithms depend on the integrity of the data to provide reliable and resilient solutions; if the data is compromised then the whole system cannot be trusted. A lot of research is being done to make sure that AI algorithms cannot be purposely fooled; attacks such as the “adversarial image” can be potentially fatal in critical systems.

3. Testing Tools and Methodologies: Software development has been changing in recent years due to the increase of computational power available in current systems. Software is becoming dynamic and the predictability of such systems is becoming non-existent. This makes the testing of autonomous systems extremely difficult. Developers cannot use the conventional testing methodologies to test their algorithms, they must rely on computational models and scenario generation to test the various use cases users may encounter. On average, current commercial software only tests about 6 percent of the lines of code written, that is unit tests and integration tests with a well-defined set of parameters. Autonomous systems are different from these algorithms because the amount of data they need to learn grows exponentially from static software implementations. It’s hard to predict all scenarios the autonomous system will encounter out in the wild, and the complexity to generate scenario models increases with the size and criticality of the system.

Trust will define how much humans rely on these emerging technologies. The lack of trust will constrain their abilities and usability. We build systems with great capabilities but we often constrain them due to security or technical concerns. This is why we must strive to find methodologies that enable us to build secure, reliable, and resilient systems that humans can truly use without questioning their process or reasoning.

tl;dr"
Older Adults Don't Entirely Trust Robots With Kids
Connect Reliably to ROS 1 and 2 Stacks With High-Rate and Large Messages
"Reliable way to generate grasp position on 3D modelsHi all, I am writing my thesis on ML and grasp on object but I can't find any way to generate the best position of a gripper on an object. Anyone have anything ? Feeling kinda desperate

&#x200B;

Thanks for your answers, I really appreciate and I will read that!

For the details, I have multiple 3D models of objects in the STL format, so I could go into a points cloud but I guess staying in mesh keep more info.

&#x200B;

My end goal is to build a AI algorithm to choose the best end effector given an object.

So I need a program/system to calculate analytically or empirically one/multiple grasp poses for different grippers (in priority two and three fingers parallel claws, big issue is the 3-finger claw) and get the associated metrics.

I know theoretically it's just a complicated math problem so I expected to find something that would compute it but I couldn't find it yet, or maybe it exists but I just didn't found it yet.

&#x200B;

Side note is that it would be a gripping in a normal manner so only from the top, which reduces the computation by a lot.

&#x200B;

&#x200B;

Edit: more details

&#x200B;"
How do you peel such stickers (not available in rolled condition) with Robots? Preferably Cobots? We tried Pneumatic suction cups but wasn't reliable. Any ideas? Anyone did anything similar? Any video references of similar applications?
"Pc vs laptopHi I'm a prospective robotics msc at delft, and was thinking to upgrade my already existing laptop as it i behaves very strangely/has little ram and no graphics card. 
I was stuck between choosing a pc or a laptop. I was wondering if anyone knew how computationally expensive university courseworks could be in Robotics, and therefore if they could suggest me to get a good pc or  if a laptop could suffice. Mind you if I had a pc I would still keep my laptop for when i go to the library, however it isn't so reliable for very computationally heavy code..

Thanks you in advance :)"
how can I connect the gear/shaft to a printed part reliably?
"Carter Schultz of AMP Robotics is a 2023 Reddit Robotics Showcase Keynote Speaker![https://www.youtube.com/watch?v=wCcTrivOAQ0](https://www.youtube.com/watch?v=wCcTrivOAQ0)

&#x200B;

[Carter Schultz](https://preview.redd.it/1kkbuxt5baza1.png?width=1258&format=png&auto=webp&v=enabled&s=b2e6ed3152b07162bbd5e1dfb4676d40c5337dac)

We are thrilled to welcome Carter Schultz, Robotics Architect at AMP Robotics, as a 2023 Reddit Robotics Showcase Keynote Speaker! He will be discussing The Reality of Robotic Systems. From AMP:

""Asked to describe a robot, most would default to a character from science fiction—something resembling a human form. What ultimately became AMP Robotics can even be traced back to Founder Matanya Horowitz’s early fascination with such animated characters. But as robotics applications evolve, it’s time to challenge—or expand—the traditional understanding of a robot. We’ll explore recycling and how robotic sorting units driven by AI are bringing much-needed change to an industry not known for innovation, while demonstrating the usefulness of conceiving of “robots” as large, autonomous systems.  


This talk will illuminate how cutting-edge technologies are revolutionizing recycling by addressing constraints most people may not even know exist, framed against the backdrop of how autonomous systems operate in other industrial environments—and why the realm of recycling is so unique.""

&#x200B;

https://preview.redd.it/r0sqp0abbaza1.jpg?width=4715&format=pjpg&auto=webp&v=enabled&s=30914ad6ff480c162b36e3a1705c4735e3a41e3b

AMP Robotics is modernizing and scaling the world’s recycling infrastructure by applying AI and automation to increase recycling rates and economically recover recyclables reclaimed as raw materials for the global supply chain. In addition to developing AI-enabled solutions to retrofit existing recycling facilities, AMP also designs, builds, and operates new facilities powered by its application of AI for material identification and advanced automation. With hundreds of deployments across North America, Asia, and Europe, AMP’s technology recovers plastics, paper, and metals from municipal collection, precious commodities from electronic scrap, high-value materials from construction and demolition debris, and valuable feedstocks from organic material.

&#x200B;

For more information on AMP Robotics, please visit the links below:

* [Youtube](https://www.youtube.com/@AMPRobotics/videos)
* [Website](https://www.amprobotics.com/)
* [Linkedin](https://www.linkedin.com/company/amp-robotics/)
* [Twitter](https://twitter.com/AMPRobotics)
* [Instagram](https://www.instagram.com/amprobotics/)

&#x200B;

Click [here](https://redditroboticsshowcase.wordpress.com/) for more information on the Reddit Robotics Showcase. We hope to see you there!"
"IMU - looking for a reliable productHi all,

I'm looking for a reliable imu for a autonomous vehicle. It's been a while since i last needed such a device. So, I don't know what is popular nowadays.

I have used 2 good imu/ins in the past: xsens mti-710 and ixblue ursa5. But, my budget is limited to usd$1.000 in this project.

I would really appreciate a recommendation.

I'm concerned because most cheap imu feel like random number generators. I have used adis16470 and it is kinda bad.

I'm thinking on buying the um7.

Thanks!"
"Need Help in moving to computer aided design of robotsHello everyone,   
Till now i have avoided 3d printing and such and only made robots by hand, only using pc for coding.  But for the next robot im planning to make, i want to use ROS, gazebo, fusion 360 and cool stuff like that to make a more reliable and stable long lasting robot. Ii is a desktop assistant like robot that stays in one place and movement is only through servos(6-7 servos) i'll be using raspberry pi for it. I can handle the coding part but pls give me a short intro to how to correctly use the above mentioned software to make a cool 3d printed robot."
usb camera cable extensionI want to make a robot that has contolled by cable. I want to get camera video but after 6 meter usb cable I get data loss. How can I solve it? I googled about cable extension but I didn't find any solution except ethernet cable extension. Is this a reliable soultion? Can I use that solution to extend my cable to 30 meter?
"question about SLAM in industry autonomous driving applications vs academiaI just started doing research in SLAM as a graduate student, and I now feel a little existential crisis about the SLAM research community in academia. For example, in the robot perception field, a lot of work is focusing on how to make the robot perception algorithm robust, etc, and then once they verify their method they do some simple experiments where they might use a hand-help camera to showcase its robustness.

But, how come tech companies like Tesla have already embedded its reliable autopilot algorithm into every single car that relies on perception, and the academia is sometimes still playing with toy examples in their publications? I now feel lost about what to do in SLAM. Autonomous driving is already pioneered by companies like Tesla, so what else is there to be done?"
"Where can I get custom closed loop GT2 belts?I have a 3d printed 330mm Ninja Flex closed-loop belt I'm using now. But I'm not certain of its long term durability. There are a couple sites online where I can buy them, but I'm wondering if anyone has a trusted source.

I've also tried glueing an ""endless"" belt based on some online tutorials, but they tore apart right away. I need something reliable."
"How reliable is amcl?I implemented the move_base navigation stack on my robot to move through a building with tight spaces along the corridor (2-5cm tolerance). However, it doesn’t seem to be able to consistently move through these spaces."
